1,"Morbi odio odio, elementum eu, interdum eu, tincidunt in, leo.",2022-01-01 20:47:14,2021-04-22 12:48:23,null,553,63
2,Integer ac leo.,2021-08-04 10:56:06,2021-07-16 10:58:54,null,724,92
3,"Vestibulum quam sapien, varius ut, blandit non, interdum in, ante. Vestibulum ante ipsum primis in faucibus orci luctus et ultrices posuere cubilia Curae; Duis faucibus accumsan odio. Curabitur convallis.",2021-10-13 22:04:17,2021-05-19 21:46:44,null,807,90
4,Sed accumsan felis. Ut at dolor quis odio consequat varius.,2021-02-11 17:23:51,2021-05-11 09:13:28,null,751,42
5,In hac habitasse platea dictumst. Maecenas ut massa quis augue luctus tincidunt. Nulla mollis molestie lorem.,2021-10-19 03:45:09,2021-08-30 09:51:55,null,48,71
6,Morbi non lectus.,2021-06-05 04:15:24,2021-09-03 09:22:57,null,743,88
7,"Donec diam neque, vestibulum eget, vulputate ut, ultrices vel, augue. Vestibulum ante ipsum primis in faucibus orci luctus et ultrices posuere cubilia Curae; Donec pharetra, magna vestibulum aliquet ultrices, erat tortor sollicitudin mi, sit amet lobortis sapien sapien non mi.",2021-07-14 02:01:25,2021-06-08 05:23:36,null,820,65
8,Integer ac neque.,2021-12-26 02:24:58,2021-06-12 14:01:04,null,976,16
9,"Phasellus id sapien in sapien iaculis congue. Vivamus metus arcu, adipiscing molestie, hendrerit at, vulputate vitae, nisl.",2021-06-10 23:56:19,2021-03-12 19:32:31,null,863,35
10,"Mauris enim leo, rhoncus sed, vestibulum sit amet, cursus id, turpis.",2021-05-25 09:44:05,2021-09-14 20:42:46,null,841,22
11,In sagittis dui vel nisl.,2022-01-21 05:27:57,2021-10-13 00:35:09,null,124,2
12,"Mauris ullamcorper purus sit amet nulla. Quisque arcu libero, rutrum ac, lobortis vel, dapibus at, diam.",2021-06-24 02:59:06,2021-07-31 09:18:23,null,956,16
13,"Donec ut mauris eget massa tempor convallis. Nulla neque libero, convallis eget, eleifend luctus, ultricies eu, nibh.",2021-06-30 18:19:33,2021-12-12 02:12:33,null,229,56
14,Donec quis orci eget orci vehicula condimentum. Curabitur in libero ut massa volutpat convallis.,2021-11-05 16:38:41,2021-10-10 16:14:12,null,257,84
15,"In hac habitasse platea dictumst. Aliquam augue quam, sollicitudin vitae, consectetuer eget, rutrum at, lorem.",2021-02-24 22:05:23,2021-07-08 05:29:46,null,749,64
16,In hac habitasse platea dictumst.,2021-07-31 09:24:20,2021-10-29 04:15:01,null,616,47
17,"Sed sagittis. Nam congue, risus semper porta volutpat, quam pede lobortis ligula, sit amet eleifend pede libero quis orci.",2021-09-01 03:45:58,2021-06-17 22:34:41,null,293,1
18,Pellentesque at nulla. Suspendisse potenti.,2021-08-06 15:18:35,2021-03-27 01:47:15,null,687,50
19,Sed ante. Vivamus tortor.,2021-12-09 18:53:57,2021-03-09 22:34:22,null,819,61
20,Phasellus sit amet erat. Nulla tempus. Vivamus in felis eu sapien cursus vestibulum.,2021-05-05 20:28:38,2021-06-25 21:02:43,null,126,62
21,"Duis ac nibh. Fusce lacus purus, aliquet at, feugiat non, pretium quis, lectus.",2021-10-24 17:21:53,2021-08-15 09:30:57,null,841,38
22,Aenean fermentum.,2021-05-02 10:06:29,2021-02-24 23:29:56,null,747,36
23,Vivamus tortor. Duis mattis egestas metus. Aenean fermentum.,2021-02-05 22:00:53,2021-05-16 04:01:42,null,402,43
24,"Duis bibendum, felis sed interdum venenatis, turpis enim blandit mi, in porttitor pede justo eu massa.",2021-12-22 23:08:35,2021-06-15 12:12:07,null,881,9
25,"Fusce congue, diam id ornare imperdiet, sapien urna pretium nisl, ut volutpat sapien arcu sed augue. Aliquam erat volutpat.",2021-08-05 13:51:25,2021-11-01 23:23:53,null,553,61
26,Integer ac neque.,2021-06-02 00:02:29,2021-11-07 11:24:55,null,93,50
27,Integer ac neque. Duis bibendum.,2021-04-10 04:15:56,2021-06-17 19:45:46,null,816,44
28,"Duis ac nibh. Fusce lacus purus, aliquet at, feugiat non, pretium quis, lectus. Suspendisse potenti.",2021-12-09 22:15:10,2021-12-13 08:55:22,null,586,87
29,Praesent id massa id nisl venenatis lacinia. Aenean sit amet justo. Morbi ut odio.,2021-06-03 15:09:05,2021-12-30 22:00:13,null,901,35
30,"In blandit ultrices enim. Lorem ipsum dolor sit amet, consectetuer adipiscing elit.",2021-05-10 17:49:19,2021-02-10 22:26:04,null,560,14
31,Integer ac leo. Pellentesque ultrices mattis odio.,2021-12-06 10:19:27,2021-06-29 04:23:44,null,149,49
32,"Lorem ipsum dolor sit amet, consectetuer adipiscing elit. Proin interdum mauris non ligula pellentesque ultrices.",2022-01-03 09:18:57,2021-11-08 01:04:38,null,865,28
33,Praesent id massa id nisl venenatis lacinia.,2021-05-21 05:33:46,2021-08-24 23:43:45,null,739,41
34,Vivamus in felis eu sapien cursus vestibulum.,2021-11-07 13:21:52,2021-06-23 11:19:37,null,724,44
35,Vivamus tortor. Duis mattis egestas metus.,2021-08-23 20:05:32,2021-09-24 10:26:22,null,623,37
36,Pellentesque at nulla. Suspendisse potenti. Cras in purus eu magna vulputate luctus.,2022-01-08 22:10:55,2021-06-19 09:27:55,null,872,25
37,"In tempor, turpis nec euismod scelerisque, quam turpis adipiscing lorem, vitae mattis nibh ligula nec sem.",2021-11-07 02:28:27,2021-06-15 15:27:13,null,662,39
38,Morbi a ipsum.,2021-06-28 12:54:13,2022-01-14 12:23:19,null,104,14
39,Integer a nibh. In quis justo. Maecenas rhoncus aliquam lacus.,2022-01-19 16:02:09,2021-09-11 14:02:23,null,944,74
40,In congue. Etiam justo. Etiam pretium iaculis justo.,2021-06-15 07:08:53,2021-02-01 19:03:36,null,98,41
41,In hac habitasse platea dictumst. Etiam faucibus cursus urna. Ut tellus.,2021-04-09 00:55:29,2021-08-09 02:55:09,null,928,7
42,"Vestibulum ante ipsum primis in faucibus orci luctus et ultrices posuere cubilia Curae; Donec pharetra, magna vestibulum aliquet ultrices, erat tortor sollicitudin mi, sit amet lobortis sapien sapien non mi. Integer ac neque.",2021-12-09 02:01:35,2021-05-20 08:15:55,null,63,60
43,In hac habitasse platea dictumst.,2021-08-06 10:35:04,2021-06-13 10:25:31,null,157,94
44,Ut tellus. Nulla ut erat id mauris vulputate elementum.,2021-08-25 06:21:52,2021-07-26 08:02:01,null,548,22
45,Nunc purus.,2021-07-19 12:23:19,2021-04-15 17:27:32,null,793,42
46,"Aenean fermentum. Donec ut mauris eget massa tempor convallis. Nulla neque libero, convallis eget, eleifend luctus, ultricies eu, nibh.",2021-08-04 23:14:43,2021-10-07 21:03:27,null,889,59
47,"Curabitur gravida nisi at nibh. In hac habitasse platea dictumst. Aliquam augue quam, sollicitudin vitae, consectetuer eget, rutrum at, lorem.",2021-07-03 22:17:09,2021-08-20 15:59:20,null,324,97
48,Pellentesque eget nunc. Donec quis orci eget orci vehicula condimentum.,2021-07-26 09:12:47,2021-10-11 17:24:40,null,140,34
49,Duis aliquam convallis nunc. Proin at turpis a pede posuere nonummy.,2021-03-14 08:17:47,2021-04-01 08:15:25,null,643,42
50,"Donec diam neque, vestibulum eget, vulputate ut, ultrices vel, augue.",2021-08-24 23:48:03,2021-06-07 10:42:47,null,901,41
51,"Fusce congue, diam id ornare imperdiet, sapien urna pretium nisl, ut volutpat sapien arcu sed augue. Aliquam erat volutpat.",2021-10-05 22:39:00,2021-05-11 08:22:22,null,922,44
52,Praesent blandit lacinia erat.,2021-07-15 22:11:53,2021-11-28 09:09:17,null,558,49
53,"Proin at turpis a pede posuere nonummy. Integer non velit. Donec diam neque, vestibulum eget, vulputate ut, ultrices vel, augue.",2021-04-04 23:01:53,2021-07-30 17:55:18,null,976,17
54,Suspendisse ornare consequat lectus.,2021-07-14 02:11:36,2021-06-13 02:45:37,null,435,5
55,"Vestibulum ante ipsum primis in faucibus orci luctus et ultrices posuere cubilia Curae; Nulla dapibus dolor vel est. Donec odio justo, sollicitudin ut, suscipit a, feugiat et, eros.",2021-03-08 05:53:43,2022-01-07 14:29:48,null,573,45
56,"Maecenas leo odio, condimentum id, luctus nec, molestie sed, justo. Pellentesque viverra pede ac diam.",2021-06-20 13:34:08,2022-01-22 05:28:43,null,712,29
57,Quisque ut erat.,2021-10-07 05:34:41,2021-11-24 19:57:32,null,287,28
58,"Morbi non lectus. Aliquam sit amet diam in magna bibendum imperdiet. Nullam orci pede, venenatis non, sodales sed, tincidunt eu, felis.",2021-11-27 07:36:19,2021-06-25 03:22:54,null,633,93
59,Suspendisse potenti.,2021-02-15 15:08:59,2021-10-16 22:45:23,null,492,35
60,Aliquam quis turpis eget elit sodales scelerisque. Mauris sit amet eros. Suspendisse accumsan tortor quis turpis.,2021-08-06 04:29:02,2021-08-21 12:16:53,null,904,60
61,Etiam faucibus cursus urna. Ut tellus.,2021-07-13 08:36:38,2021-06-03 03:27:36,null,486,7
62,"Quisque erat eros, viverra eget, congue eget, semper rutrum, nulla. Nunc purus.",2021-02-23 18:09:13,2021-04-23 15:33:18,null,738,77
63,Etiam pretium iaculis justo.,2021-07-08 13:55:22,2021-07-31 02:32:38,null,873,37
64,Proin interdum mauris non ligula pellentesque ultrices. Phasellus id sapien in sapien iaculis congue.,2021-05-22 09:51:14,2021-07-15 02:02:22,null,806,17
65,Nulla ut erat id mauris vulputate elementum.,2021-06-11 00:25:21,2021-10-16 12:37:35,null,417,95
66,Nullam molestie nibh in lectus. Pellentesque at nulla. Suspendisse potenti.,2021-03-16 16:05:45,2021-11-02 05:14:26,null,892,4
67,Donec posuere metus vitae ipsum. Aliquam non mauris.,2021-09-28 13:30:52,2021-09-16 14:44:28,null,699,96
68,"Morbi ut odio. Cras mi pede, malesuada in, imperdiet et, commodo vulputate, justo.",2021-10-07 01:27:37,2021-05-03 12:39:17,null,622,85
69,"Donec odio justo, sollicitudin ut, suscipit a, feugiat et, eros. Vestibulum ac est lacinia nisi venenatis tristique. Fusce congue, diam id ornare imperdiet, sapien urna pretium nisl, ut volutpat sapien arcu sed augue.",2021-02-25 13:23:35,2021-10-14 20:54:27,null,91,17
70,Nullam sit amet turpis elementum ligula vehicula consequat.,2021-11-29 21:52:02,2021-04-30 07:45:00,null,222,85
71,Etiam pretium iaculis justo. In hac habitasse platea dictumst.,2021-02-10 02:53:43,2021-07-01 23:39:26,null,821,72
72,Duis mattis egestas metus. Aenean fermentum.,2021-04-25 07:10:36,2021-08-21 15:45:32,null,425,15
73,Duis bibendum. Morbi non quam nec dui luctus rutrum.,2021-05-30 14:38:21,2021-03-30 13:59:18,null,783,88
74,Suspendisse accumsan tortor quis turpis. Sed ante.,2021-06-21 20:16:24,2022-01-09 02:38:49,null,278,93
75,In eleifend quam a odio.,2021-12-08 08:43:41,2021-12-31 16:07:41,null,265,21
76,"Vivamus vel nulla eget eros elementum pellentesque. Quisque porta volutpat erat. Quisque erat eros, viverra eget, congue eget, semper rutrum, nulla.",2021-09-15 14:55:45,2021-12-20 03:58:03,null,692,79
77,"Cum sociis natoque penatibus et magnis dis parturient montes, nascetur ridiculus mus.",2022-01-01 01:55:26,2021-08-26 23:15:55,null,583,30
78,Nulla facilisi. Cras non velit nec nisi vulputate nonummy. Maecenas tincidunt lacus at velit.,2021-07-30 06:28:56,2021-10-12 13:43:50,null,990,86
79,"Duis bibendum, felis sed interdum venenatis, turpis enim blandit mi, in porttitor pede justo eu massa. Donec dapibus.",2021-09-22 20:17:28,2021-06-18 06:42:44,null,483,4
80,Aenean auctor gravida sem. Praesent id massa id nisl venenatis lacinia. Aenean sit amet justo.,2021-08-29 21:42:07,2021-04-11 05:43:52,null,509,76
81,Aenean fermentum. Donec ut mauris eget massa tempor convallis.,2021-03-26 11:51:22,2022-01-03 15:22:42,null,874,81
82,"Fusce posuere felis sed lacus. Morbi sem mauris, laoreet ut, rhoncus aliquet, pulvinar sed, nisl.",2021-04-07 05:38:26,2021-09-19 06:45:24,null,922,93
83,In eleifend quam a odio.,2021-11-02 23:40:50,2021-11-21 09:38:47,null,178,62
84,Suspendisse potenti. Nullam porttitor lacus at turpis.,2021-06-02 18:31:55,2021-07-30 19:35:25,null,106,11
85,"Integer pede justo, lacinia eget, tincidunt eget, tempus vel, pede.",2021-05-30 19:13:12,2021-01-27 18:47:26,null,295,5
86,Vivamus tortor. Duis mattis egestas metus.,2021-05-26 02:26:16,2021-12-04 04:37:26,null,542,22
87,"Proin leo odio, porttitor id, consequat in, consequat ut, nulla. Sed accumsan felis.",2021-08-01 06:30:01,2021-02-07 16:04:10,null,157,20
88,"Pellentesque viverra pede ac diam. Cras pellentesque volutpat dui. Maecenas tristique, est et tempus semper, est quam pharetra magna, ac consequat metus sapien ut nunc.",2021-02-26 23:12:04,2021-04-16 14:09:58,null,761,56
89,Mauris sit amet eros. Suspendisse accumsan tortor quis turpis.,2021-12-21 16:51:43,2021-09-11 11:56:11,null,580,94
90,In hac habitasse platea dictumst. Etiam faucibus cursus urna. Ut tellus.,2021-03-16 11:35:04,2021-12-21 11:31:13,null,130,32
91,Vivamus vestibulum sagittis sapien.,2021-07-24 11:12:40,2021-10-13 22:00:18,null,233,99
92,Aliquam erat volutpat.,2021-11-01 15:28:22,2021-03-14 09:41:04,null,477,94
93,"Nam ultrices, libero non mattis pulvinar, nulla pede ullamcorper augue, a suscipit nulla elit ac nulla.",2021-08-14 17:17:57,2021-12-11 21:10:43,null,944,75
94,Sed ante.,2021-12-12 10:06:23,2021-07-11 00:16:38,null,527,34
95,Cras non velit nec nisi vulputate nonummy.,2021-06-08 08:53:56,2021-03-24 12:02:51,null,896,39
96,"In hac habitasse platea dictumst. Aliquam augue quam, sollicitudin vitae, consectetuer eget, rutrum at, lorem. Integer tincidunt ante vel ipsum.",2021-09-09 23:38:59,2021-10-16 17:52:49,null,672,48
97,"Morbi sem mauris, laoreet ut, rhoncus aliquet, pulvinar sed, nisl. Nunc rhoncus dui vel sem. Sed sagittis.",2021-10-10 12:51:26,2021-09-19 18:07:32,null,915,35
98,Donec ut dolor. Morbi vel lectus in quam fringilla rhoncus.,2021-12-13 14:03:49,2021-07-31 01:54:41,null,750,41
99,"In est risus, auctor sed, tristique in, tempus sit amet, sem. Fusce consequat.",2021-09-14 02:53:02,2021-11-10 14:31:21,null,879,99
100,"Pellentesque ultrices mattis odio. Donec vitae nisi. Nam ultrices, libero non mattis pulvinar, nulla pede ullamcorper augue, a suscipit nulla elit ac nulla.",2021-04-18 01:00:38,2021-05-22 01:12:15,null,787,61
101,"Aliquam augue quam, sollicitudin vitae, consectetuer eget, rutrum at, lorem. Integer tincidunt ante vel ipsum. Praesent blandit lacinia erat.",2021-09-12 01:43:48,2021-02-01 23:47:50,null,938,68
102,Duis aliquam convallis nunc.,2021-06-22 01:53:15,2021-05-24 09:20:50,null,477,76
103,In hac habitasse platea dictumst. Etiam faucibus cursus urna.,2021-05-26 11:19:27,2022-01-02 14:54:36,null,800,89
104,Nulla facilisi. Cras non velit nec nisi vulputate nonummy.,2021-03-14 09:28:03,2022-01-10 15:57:45,null,821,46
105,Etiam justo.,2021-02-27 11:11:33,2021-07-12 10:45:09,null,583,79
106,Nulla suscipit ligula in lacus. Curabitur at ipsum ac tellus semper interdum. Mauris ullamcorper purus sit amet nulla.,2021-10-17 10:40:29,2021-03-13 01:47:39,null,401,86
107,Etiam faucibus cursus urna.,2021-10-13 01:30:42,2021-12-12 07:20:21,null,224,80
108,"Maecenas rhoncus aliquam lacus. Morbi quis tortor id nulla ultrices aliquet. Maecenas leo odio, condimentum id, luctus nec, molestie sed, justo.",2021-04-09 01:27:25,2021-04-06 09:57:38,null,857,76
109,"Mauris ullamcorper purus sit amet nulla. Quisque arcu libero, rutrum ac, lobortis vel, dapibus at, diam.",2021-08-30 14:31:33,2021-07-24 00:16:50,null,838,24
110,"Fusce posuere felis sed lacus. Morbi sem mauris, laoreet ut, rhoncus aliquet, pulvinar sed, nisl.",2021-03-08 14:34:51,2021-04-14 08:26:03,null,166,63
111,"Morbi sem mauris, laoreet ut, rhoncus aliquet, pulvinar sed, nisl. Nunc rhoncus dui vel sem.",2021-03-07 12:30:56,2021-11-29 23:13:46,null,756,56
112,"Fusce lacus purus, aliquet at, feugiat non, pretium quis, lectus.",2021-08-24 00:56:35,2021-06-20 21:15:31,null,248,35
113,Curabitur convallis. Duis consequat dui nec nisi volutpat eleifend.,2021-03-15 05:30:22,2021-07-06 10:28:47,null,467,75
114,"Morbi odio odio, elementum eu, interdum eu, tincidunt in, leo. Maecenas pulvinar lobortis est. Phasellus sit amet erat.",2021-03-18 11:22:43,2021-04-10 11:20:51,null,978,41
115,"Integer non velit. Donec diam neque, vestibulum eget, vulputate ut, ultrices vel, augue. Vestibulum ante ipsum primis in faucibus orci luctus et ultrices posuere cubilia Curae; Donec pharetra, magna vestibulum aliquet ultrices, erat tortor sollicitudin mi, sit amet lobortis sapien sapien non mi.",2021-12-26 20:00:48,2021-06-27 04:09:09,null,696,7
116,Nullam porttitor lacus at turpis. Donec posuere metus vitae ipsum.,2021-05-18 17:02:12,2021-05-22 02:15:18,null,207,79
117,Morbi a ipsum. Integer a nibh. In quis justo.,2021-01-28 13:10:03,2021-02-17 19:17:02,null,789,74
118,"Curabitur in libero ut massa volutpat convallis. Morbi odio odio, elementum eu, interdum eu, tincidunt in, leo. Maecenas pulvinar lobortis est.",2021-10-16 12:42:22,2022-01-12 16:39:00,null,48,97
119,Nulla suscipit ligula in lacus. Curabitur at ipsum ac tellus semper interdum.,2021-02-03 22:54:40,2021-11-11 00:37:44,null,349,85
120,"Donec quis orci eget orci vehicula condimentum. Curabitur in libero ut massa volutpat convallis. Morbi odio odio, elementum eu, interdum eu, tincidunt in, leo.",2021-12-01 07:13:36,2021-03-01 23:39:19,null,410,11
121,Donec quis orci eget orci vehicula condimentum.,2022-01-09 17:41:57,2021-12-18 18:42:55,null,745,64
122,"Nullam orci pede, venenatis non, sodales sed, tincidunt eu, felis. Fusce posuere felis sed lacus.",2021-04-20 00:00:36,2021-12-23 19:53:51,null,483,21
123,Duis consequat dui nec nisi volutpat eleifend. Donec ut dolor. Morbi vel lectus in quam fringilla rhoncus.,2021-05-04 15:40:24,2022-01-03 19:15:53,null,906,67
124,"Vestibulum ac est lacinia nisi venenatis tristique. Fusce congue, diam id ornare imperdiet, sapien urna pretium nisl, ut volutpat sapien arcu sed augue.",2022-01-10 21:05:08,2021-03-08 11:58:21,null,909,9
125,"Mauris ullamcorper purus sit amet nulla. Quisque arcu libero, rutrum ac, lobortis vel, dapibus at, diam.",2021-03-06 09:41:29,2021-11-25 07:44:02,null,34,73
126,"Cum sociis natoque penatibus et magnis dis parturient montes, nascetur ridiculus mus. Etiam vel augue. Vestibulum rutrum rutrum neque.",2021-02-16 17:56:33,2021-04-30 05:40:42,null,1000,25
127,Phasellus sit amet erat. Nulla tempus. Vivamus in felis eu sapien cursus vestibulum.,2021-09-11 10:04:31,2021-10-29 13:16:12,null,226,3
128,"Donec quis orci eget orci vehicula condimentum. Curabitur in libero ut massa volutpat convallis. Morbi odio odio, elementum eu, interdum eu, tincidunt in, leo.",2021-12-06 02:33:31,2021-04-11 22:19:06,null,518,52
129,"Morbi vel lectus in quam fringilla rhoncus. Mauris enim leo, rhoncus sed, vestibulum sit amet, cursus id, turpis.",2021-06-20 17:58:57,2021-05-28 06:54:34,null,114,70
130,Aenean fermentum. Donec ut mauris eget massa tempor convallis.,2021-01-31 13:59:02,2021-06-12 20:03:46,null,499,88
131,"Nulla nisl. Nunc nisl. Duis bibendum, felis sed interdum venenatis, turpis enim blandit mi, in porttitor pede justo eu massa.",2021-05-28 09:28:56,2021-09-19 14:21:19,null,544,8
132,"Phasellus id sapien in sapien iaculis congue. Vivamus metus arcu, adipiscing molestie, hendrerit at, vulputate vitae, nisl.",2021-08-06 18:01:37,2021-06-29 17:50:17,null,580,32
133,Integer non velit.,2021-10-05 02:37:10,2021-05-08 22:18:53,null,289,44
134,Praesent blandit.,2022-01-02 20:19:25,2021-06-12 21:11:39,null,960,75
135,Nulla justo.,2021-09-15 19:22:26,2021-09-05 20:20:50,null,798,33
136,Nulla mollis molestie lorem. Quisque ut erat. Curabitur gravida nisi at nibh.,2021-05-17 18:19:06,2021-05-25 22:17:27,null,905,31
137,Vestibulum rutrum rutrum neque.,2021-06-01 20:21:38,2021-09-04 00:55:20,null,476,1
138,"In tempor, turpis nec euismod scelerisque, quam turpis adipiscing lorem, vitae mattis nibh ligula nec sem.",2021-02-04 05:35:59,2021-10-08 12:21:52,null,240,4
139,Nulla justo. Aliquam quis turpis eget elit sodales scelerisque. Mauris sit amet eros.,2021-01-28 08:48:03,2021-09-29 08:20:01,null,311,13
140,"Cras in purus eu magna vulputate luctus. Cum sociis natoque penatibus et magnis dis parturient montes, nascetur ridiculus mus. Vivamus vestibulum sagittis sapien.",2021-04-03 17:38:21,2021-11-10 13:18:01,null,470,78
141,Vestibulum rutrum rutrum neque. Aenean auctor gravida sem. Praesent id massa id nisl venenatis lacinia.,2021-04-01 09:51:40,2021-04-19 15:08:56,null,985,18
142,"Suspendisse ornare consequat lectus. In est risus, auctor sed, tristique in, tempus sit amet, sem. Fusce consequat.",2021-04-04 04:30:21,2021-07-13 17:27:17,null,84,66
143,"Aliquam sit amet diam in magna bibendum imperdiet. Nullam orci pede, venenatis non, sodales sed, tincidunt eu, felis. Fusce posuere felis sed lacus.",2021-11-14 01:02:54,2021-08-28 02:12:10,null,501,21
144,"Morbi vel lectus in quam fringilla rhoncus. Mauris enim leo, rhoncus sed, vestibulum sit amet, cursus id, turpis.",2021-02-12 13:14:17,2021-03-23 00:00:11,null,187,3
145,Nullam porttitor lacus at turpis. Donec posuere metus vitae ipsum.,2021-04-12 10:29:59,2022-01-15 10:10:38,null,552,82
146,Pellentesque ultrices mattis odio.,2021-08-09 01:19:18,2021-07-03 02:49:34,null,35,82
147,Ut tellus. Nulla ut erat id mauris vulputate elementum.,2021-06-21 04:47:18,2021-06-14 08:31:19,null,760,78
148,"Fusce congue, diam id ornare imperdiet, sapien urna pretium nisl, ut volutpat sapien arcu sed augue. Aliquam erat volutpat.",2021-10-09 11:02:11,2021-08-13 14:42:28,null,794,85
149,"Proin eu mi. Nulla ac enim. In tempor, turpis nec euismod scelerisque, quam turpis adipiscing lorem, vitae mattis nibh ligula nec sem.",2021-02-22 22:40:27,2021-08-21 03:15:24,null,578,62
150,Etiam faucibus cursus urna.,2021-06-29 10:44:03,2021-10-13 09:32:50,null,215,8
151,Curabitur convallis. Duis consequat dui nec nisi volutpat eleifend.,2021-10-24 16:45:21,2021-06-26 18:51:29,null,986,8
152,Sed sagittis.,2021-04-28 02:24:10,2021-03-21 20:08:11,null,417,45
153,Nullam varius. Nulla facilisi. Cras non velit nec nisi vulputate nonummy.,2021-06-23 16:17:47,2021-11-28 01:58:01,null,623,90
154,"In blandit ultrices enim. Lorem ipsum dolor sit amet, consectetuer adipiscing elit.",2021-12-11 09:42:07,2021-09-22 15:16:07,null,622,42
155,"Mauris ullamcorper purus sit amet nulla. Quisque arcu libero, rutrum ac, lobortis vel, dapibus at, diam. Nam tristique tortor eu pede.",2021-07-04 03:48:35,2021-04-24 08:52:15,null,61,10
156,Duis consequat dui nec nisi volutpat eleifend.,2021-03-08 22:50:47,2021-04-24 16:17:22,null,661,17
157,In eleifend quam a odio. In hac habitasse platea dictumst.,2021-05-01 08:12:40,2021-10-24 12:13:58,null,665,55
158,Praesent lectus.,2021-05-16 14:52:03,2022-01-11 04:06:14,null,794,84
159,Curabitur convallis. Duis consequat dui nec nisi volutpat eleifend.,2021-05-03 01:05:40,2021-10-28 20:31:50,null,595,30
160,Praesent id massa id nisl venenatis lacinia. Aenean sit amet justo. Morbi ut odio.,2021-04-25 04:59:59,2021-11-13 04:29:52,null,885,21
161,Donec ut dolor.,2021-02-01 11:25:26,2021-07-26 03:40:35,null,252,5
162,"Quisque porta volutpat erat. Quisque erat eros, viverra eget, congue eget, semper rutrum, nulla.",2021-08-23 18:27:47,2021-10-30 19:10:50,null,231,31
163,"Fusce posuere felis sed lacus. Morbi sem mauris, laoreet ut, rhoncus aliquet, pulvinar sed, nisl. Nunc rhoncus dui vel sem.",2021-10-02 15:40:55,2021-02-14 03:48:08,null,803,17
164,"Vestibulum ac est lacinia nisi venenatis tristique. Fusce congue, diam id ornare imperdiet, sapien urna pretium nisl, ut volutpat sapien arcu sed augue.",2021-09-09 14:46:52,2021-06-26 08:51:11,null,680,94
165,"Fusce lacus purus, aliquet at, feugiat non, pretium quis, lectus. Suspendisse potenti.",2021-06-26 22:48:44,2021-03-01 13:55:18,null,866,72
166,Maecenas tincidunt lacus at velit. Vivamus vel nulla eget eros elementum pellentesque. Quisque porta volutpat erat.,2021-07-16 23:49:43,2021-09-11 02:28:04,null,310,98
167,"Fusce lacus purus, aliquet at, feugiat non, pretium quis, lectus. Suspendisse potenti.",2021-03-07 19:02:54,2021-05-20 07:50:21,null,950,34
168,"Suspendisse ornare consequat lectus. In est risus, auctor sed, tristique in, tempus sit amet, sem.",2021-05-22 10:57:04,2021-09-03 00:01:37,null,719,62
169,"Vestibulum ac est lacinia nisi venenatis tristique. Fusce congue, diam id ornare imperdiet, sapien urna pretium nisl, ut volutpat sapien arcu sed augue. Aliquam erat volutpat.",2021-05-11 17:32:59,2021-08-03 11:02:59,null,490,14
170,In sagittis dui vel nisl. Duis ac nibh.,2022-01-25 19:43:42,2021-09-18 09:09:02,null,708,14
171,Praesent id massa id nisl venenatis lacinia. Aenean sit amet justo. Morbi ut odio.,2021-06-27 06:16:04,2021-05-30 01:40:05,null,811,80
172,Maecenas ut massa quis augue luctus tincidunt. Nulla mollis molestie lorem.,2021-08-03 04:35:38,2021-09-08 18:10:32,null,563,26
173,"Duis at velit eu est congue elementum. In hac habitasse platea dictumst. Morbi vestibulum, velit id pretium iaculis, diam erat fermentum justo, nec condimentum neque sapien placerat ante.",2021-11-19 15:27:41,2021-12-05 23:03:14,null,986,36
174,Praesent id massa id nisl venenatis lacinia. Aenean sit amet justo. Morbi ut odio.,2021-12-22 00:00:47,2021-04-25 19:17:05,null,622,7
175,Vestibulum rutrum rutrum neque. Aenean auctor gravida sem.,2021-11-21 21:43:26,2021-05-27 10:01:26,null,523,7
176,Pellentesque at nulla. Suspendisse potenti. Cras in purus eu magna vulputate luctus.,2022-01-01 22:09:54,2021-04-18 21:23:47,null,253,27
177,Nunc rhoncus dui vel sem. Sed sagittis.,2021-09-23 02:39:49,2021-05-19 14:04:15,null,167,21
178,"Aliquam augue quam, sollicitudin vitae, consectetuer eget, rutrum at, lorem. Integer tincidunt ante vel ipsum. Praesent blandit lacinia erat.",2021-09-09 17:39:14,2021-04-09 05:37:02,null,260,98
179,Duis at velit eu est congue elementum.,2021-06-07 13:39:52,2021-09-25 07:37:24,null,912,86
180,Phasellus id sapien in sapien iaculis congue.,2022-01-22 06:45:43,2022-01-12 20:55:21,null,868,52
181,Nulla mollis molestie lorem.,2021-08-15 18:28:54,2021-11-01 19:00:09,null,243,45
182,"In tempor, turpis nec euismod scelerisque, quam turpis adipiscing lorem, vitae mattis nibh ligula nec sem.",2021-10-26 08:21:38,2022-01-11 10:26:54,null,81,89
183,"Vestibulum ante ipsum primis in faucibus orci luctus et ultrices posuere cubilia Curae; Donec pharetra, magna vestibulum aliquet ultrices, erat tortor sollicitudin mi, sit amet lobortis sapien sapien non mi. Integer ac neque.",2021-07-11 01:35:07,2021-06-29 00:11:41,null,962,26
