378,Sed vel enim sit amet nunc viverra dapibus. Nulla suscipit ligula in lacus. Curabitur at ipsum ac tellus semper interdum.,2022-01-17 14:45:57,2021-10-05 21:57:22,378,231,7
379,Vivamus vestibulum sagittis sapien.,2021-07-01 06:12:22,2021-06-19 08:25:15,379,187,2
380,"Vestibulum quam sapien, varius ut, blandit non, interdum in, ante.",2021-10-26 21:04:02,2021-05-21 15:32:35,380,914,69
381,"Aliquam sit amet diam in magna bibendum imperdiet. Nullam orci pede, venenatis non, sodales sed, tincidunt eu, felis. Fusce posuere felis sed lacus.",2021-06-07 08:29:51,2021-05-04 07:43:14,381,807,12
382,Donec semper sapien a libero. Nam dui.,2021-10-04 23:26:20,2022-01-18 22:10:11,382,911,36
383,Nullam sit amet turpis elementum ligula vehicula consequat. Morbi a ipsum. Integer a nibh.,2021-08-29 03:32:55,2021-10-19 13:58:18,383,414,98
384,Nulla ac enim.,2021-09-22 03:21:44,2021-10-16 01:05:04,384,323,51
385,Vestibulum rutrum rutrum neque.,2021-07-18 14:43:59,2021-09-03 21:20:17,385,469,97
386,"Morbi sem mauris, laoreet ut, rhoncus aliquet, pulvinar sed, nisl. Nunc rhoncus dui vel sem. Sed sagittis.",2021-08-15 10:23:55,2021-11-14 20:06:10,386,629,31
387,Fusce posuere felis sed lacus.,2021-05-18 21:19:52,2021-06-29 11:08:24,387,357,36
388,Aenean sit amet justo. Morbi ut odio.,2021-07-16 11:43:18,2021-10-12 06:07:13,388,97,100
389,Integer ac neque. Duis bibendum.,2021-07-04 17:44:15,2021-07-14 13:09:37,389,532,40
390,Cras non velit nec nisi vulputate nonummy.,2021-06-15 12:11:16,2021-12-29 18:40:31,390,673,74
391,In hac habitasse platea dictumst. Etiam faucibus cursus urna.,2021-10-21 06:34:02,2021-07-23 04:35:19,391,700,85
392,"Duis bibendum, felis sed interdum venenatis, turpis enim blandit mi, in porttitor pede justo eu massa.",2021-10-19 15:23:40,2021-04-20 01:07:45,392,880,18
393,Nullam porttitor lacus at turpis. Donec posuere metus vitae ipsum. Aliquam non mauris.,2021-03-11 12:00:49,2021-09-14 12:58:50,393,875,87
394,"Morbi vestibulum, velit id pretium iaculis, diam erat fermentum justo, nec condimentum neque sapien placerat ante. Nulla justo. Aliquam quis turpis eget elit sodales scelerisque.",2021-06-23 08:45:51,2021-02-19 11:49:10,394,613,52
395,Nulla mollis molestie lorem. Quisque ut erat. Curabitur gravida nisi at nibh.,2021-03-23 01:01:37,2021-07-26 08:48:53,395,100,21
396,"Fusce lacus purus, aliquet at, feugiat non, pretium quis, lectus.",2021-07-20 07:56:32,2022-01-12 05:29:37,396,374,17
397,Nunc purus.,2021-04-28 14:39:40,2021-03-17 22:40:18,397,556,54
398,Cras non velit nec nisi vulputate nonummy. Maecenas tincidunt lacus at velit. Vivamus vel nulla eget eros elementum pellentesque.,2021-03-29 09:28:35,2021-09-16 02:49:15,398,601,3
399,In eleifend quam a odio.,2021-07-18 02:59:55,2021-12-29 13:23:39,399,937,17
400,Etiam justo. Etiam pretium iaculis justo.,2021-03-19 00:19:46,2021-09-29 12:25:16,400,614,74
401,Sed accumsan felis.,2021-09-29 21:53:52,2021-06-18 21:26:56,401,848,50
402,Maecenas tincidunt lacus at velit. Vivamus vel nulla eget eros elementum pellentesque.,2021-05-26 07:55:53,2021-02-27 12:36:51,402,667,14
403,Vestibulum sed magna at nunc commodo placerat. Praesent blandit.,2021-09-30 09:12:24,2021-07-16 13:47:40,403,60,34
404,"Morbi quis tortor id nulla ultrices aliquet. Maecenas leo odio, condimentum id, luctus nec, molestie sed, justo.",2021-03-31 12:06:48,2021-12-11 20:23:52,404,525,19
405,Nullam sit amet turpis elementum ligula vehicula consequat.,2022-01-13 13:35:37,2021-06-20 04:22:50,405,449,16
406,Maecenas pulvinar lobortis est. Phasellus sit amet erat.,2021-08-01 15:19:08,2022-01-25 09:57:09,406,114,44
407,"Donec odio justo, sollicitudin ut, suscipit a, feugiat et, eros. Vestibulum ac est lacinia nisi venenatis tristique. Fusce congue, diam id ornare imperdiet, sapien urna pretium nisl, ut volutpat sapien arcu sed augue.",2021-11-12 20:07:46,2021-08-29 09:36:01,407,5,2
408,"Cras pellentesque volutpat dui. Maecenas tristique, est et tempus semper, est quam pharetra magna, ac consequat metus sapien ut nunc.",2021-07-29 02:56:14,2021-03-11 19:44:44,408,908,1
409,Nunc rhoncus dui vel sem.,2021-08-18 16:16:52,2021-03-15 11:07:12,409,977,8
410,In congue. Etiam justo. Etiam pretium iaculis justo.,2021-07-23 21:13:28,2022-01-06 07:46:08,410,947,34
411,"Vivamus vestibulum sagittis sapien. Cum sociis natoque penatibus et magnis dis parturient montes, nascetur ridiculus mus.",2021-08-11 21:24:45,2021-09-26 13:32:26,411,697,22
412,"Nullam orci pede, venenatis non, sodales sed, tincidunt eu, felis. Fusce posuere felis sed lacus.",2021-05-02 10:58:29,2021-12-03 18:17:31,412,191,61
413,"Lorem ipsum dolor sit amet, consectetuer adipiscing elit. Proin interdum mauris non ligula pellentesque ultrices. Phasellus id sapien in sapien iaculis congue.",2021-10-11 19:24:39,2021-08-06 02:24:32,413,40,6
414,"Morbi non lectus. Aliquam sit amet diam in magna bibendum imperdiet. Nullam orci pede, venenatis non, sodales sed, tincidunt eu, felis.",2022-01-11 21:06:56,2021-11-14 12:15:42,414,526,52
415,"Integer aliquet, massa id lobortis convallis, tortor risus dapibus augue, vel accumsan tellus nisi eu orci. Mauris lacinia sapien quis libero. Nullam sit amet turpis elementum ligula vehicula consequat.",2021-07-26 13:39:14,2021-02-10 10:06:24,415,390,38
416,Mauris sit amet eros.,2021-03-07 13:52:31,2021-05-21 12:18:28,416,167,22
417,"Morbi sem mauris, laoreet ut, rhoncus aliquet, pulvinar sed, nisl. Nunc rhoncus dui vel sem.",2021-05-24 05:36:24,2021-09-15 16:33:50,417,152,3
418,Cras non velit nec nisi vulputate nonummy. Maecenas tincidunt lacus at velit.,2021-11-28 02:22:22,2021-10-14 01:59:50,418,481,29
419,Praesent blandit lacinia erat. Vestibulum sed magna at nunc commodo placerat.,2021-03-19 05:47:32,2021-08-11 21:23:07,419,642,55
420,"Maecenas tristique, est et tempus semper, est quam pharetra magna, ac consequat metus sapien ut nunc. Vestibulum ante ipsum primis in faucibus orci luctus et ultrices posuere cubilia Curae; Mauris viverra diam vitae quam.",2021-05-15 02:06:24,2021-10-05 23:13:05,420,664,76
421,Integer a nibh.,2021-05-31 08:56:12,2021-06-26 09:25:20,421,38,53
422,Duis at velit eu est congue elementum. In hac habitasse platea dictumst.,2021-11-22 03:34:49,2022-01-10 14:01:20,422,151,17
423,Proin risus. Praesent lectus.,2021-03-27 22:33:15,2021-01-28 05:58:57,423,656,83
424,Aenean fermentum.,2021-04-21 16:31:57,2021-11-09 16:51:30,424,686,24
425,In sagittis dui vel nisl.,2021-04-24 03:23:29,2021-11-16 19:10:29,425,85,74
426,Proin eu mi. Nulla ac enim.,2021-02-04 02:47:04,2021-07-30 22:15:22,426,705,96
427,Pellentesque viverra pede ac diam.,2021-08-15 12:53:14,2021-07-18 16:06:25,427,905,56
428,"Phasellus id sapien in sapien iaculis congue. Vivamus metus arcu, adipiscing molestie, hendrerit at, vulputate vitae, nisl. Aenean lectus.",2021-12-05 05:49:01,2021-12-14 18:22:38,428,125,93
429,"Donec ut mauris eget massa tempor convallis. Nulla neque libero, convallis eget, eleifend luctus, ultricies eu, nibh. Quisque id justo sit amet sapien dignissim vestibulum.",2021-03-14 06:06:01,2021-09-09 13:16:22,429,483,37
430,Nam dui.,2021-01-26 16:05:09,2021-06-19 21:48:13,430,409,81
431,Cras non velit nec nisi vulputate nonummy. Maecenas tincidunt lacus at velit. Vivamus vel nulla eget eros elementum pellentesque.,2021-08-06 15:04:12,2021-02-15 00:45:24,431,324,88
432,"Nullam orci pede, venenatis non, sodales sed, tincidunt eu, felis. Fusce posuere felis sed lacus.",2021-09-19 14:42:35,2021-10-06 18:15:37,432,51,22
433,Nulla facilisi.,2021-07-13 17:16:55,2021-06-09 02:41:37,433,325,98
434,Nulla suscipit ligula in lacus. Curabitur at ipsum ac tellus semper interdum.,2021-07-26 13:44:20,2021-04-14 19:37:07,434,464,28
435,"Cras pellentesque volutpat dui. Maecenas tristique, est et tempus semper, est quam pharetra magna, ac consequat metus sapien ut nunc. Vestibulum ante ipsum primis in faucibus orci luctus et ultrices posuere cubilia Curae; Mauris viverra diam vitae quam.",2021-03-19 17:34:59,2021-11-12 22:38:10,435,858,79
436,Suspendisse accumsan tortor quis turpis. Sed ante.,2021-05-25 16:17:19,2021-09-29 16:31:02,436,510,80
437,Donec dapibus. Duis at velit eu est congue elementum. In hac habitasse platea dictumst.,2021-11-21 06:34:04,2021-09-08 19:57:19,437,97,38
438,"Donec diam neque, vestibulum eget, vulputate ut, ultrices vel, augue. Vestibulum ante ipsum primis in faucibus orci luctus et ultrices posuere cubilia Curae; Donec pharetra, magna vestibulum aliquet ultrices, erat tortor sollicitudin mi, sit amet lobortis sapien sapien non mi. Integer ac neque.",2021-12-12 07:53:35,2021-02-14 14:21:15,438,508,6
439,"Maecenas tristique, est et tempus semper, est quam pharetra magna, ac consequat metus sapien ut nunc. Vestibulum ante ipsum primis in faucibus orci luctus et ultrices posuere cubilia Curae; Mauris viverra diam vitae quam.",2021-04-04 23:01:10,2021-11-26 02:14:33,439,199,13
440,Morbi non quam nec dui luctus rutrum. Nulla tellus. In sagittis dui vel nisl.,2021-04-14 17:41:30,2021-03-28 06:26:13,440,11,100
441,Integer ac leo. Pellentesque ultrices mattis odio. Donec vitae nisi.,2021-10-14 19:54:01,2021-10-06 14:00:03,441,301,97
442,Aenean sit amet justo. Morbi ut odio.,2021-11-28 03:15:04,2021-09-24 07:15:57,442,618,50
443,Nullam sit amet turpis elementum ligula vehicula consequat. Morbi a ipsum. Integer a nibh.,2021-08-10 01:00:43,2021-12-05 16:57:03,443,444,91
444,"Fusce lacus purus, aliquet at, feugiat non, pretium quis, lectus. Suspendisse potenti. In eleifend quam a odio.",2021-02-16 12:46:00,2021-08-05 21:58:34,444,626,93
445,"Donec ut mauris eget massa tempor convallis. Nulla neque libero, convallis eget, eleifend luctus, ultricies eu, nibh. Quisque id justo sit amet sapien dignissim vestibulum.",2021-04-23 12:30:32,2021-09-10 00:30:32,445,606,40
446,Nulla mollis molestie lorem. Quisque ut erat.,2021-03-10 22:15:15,2021-11-24 07:40:37,446,796,30
447,"Morbi non lectus. Aliquam sit amet diam in magna bibendum imperdiet. Nullam orci pede, venenatis non, sodales sed, tincidunt eu, felis.",2021-06-29 10:36:47,2021-12-01 23:23:04,447,333,13
448,In hac habitasse platea dictumst.,2022-01-19 09:33:28,2021-03-07 14:10:32,448,876,48
449,"Nunc nisl. Duis bibendum, felis sed interdum venenatis, turpis enim blandit mi, in porttitor pede justo eu massa. Donec dapibus.",2021-07-23 14:16:17,2021-08-09 08:10:14,449,660,28
450,Phasellus sit amet erat.,2021-02-15 23:56:59,2021-09-03 06:14:20,450,413,10
451,Vestibulum ante ipsum primis in faucibus orci luctus et ultrices posuere cubilia Curae; Duis faucibus accumsan odio. Curabitur convallis. Duis consequat dui nec nisi volutpat eleifend.,2021-02-25 20:47:08,2021-11-03 19:05:44,451,327,14
452,Vivamus in felis eu sapien cursus vestibulum. Proin eu mi. Nulla ac enim.,2021-08-20 12:42:55,2021-09-16 05:36:07,452,445,99
453,"Aliquam sit amet diam in magna bibendum imperdiet. Nullam orci pede, venenatis non, sodales sed, tincidunt eu, felis. Fusce posuere felis sed lacus.",2021-02-17 04:53:15,2021-09-13 13:26:24,453,642,20
454,In eleifend quam a odio. In hac habitasse platea dictumst.,2021-03-06 00:38:09,2021-12-02 00:27:39,454,549,67
455,In congue. Etiam justo. Etiam pretium iaculis justo.,2021-02-25 12:15:42,2021-03-01 19:17:44,455,268,22
456,"Integer pede justo, lacinia eget, tincidunt eget, tempus vel, pede. Morbi porttitor lorem id ligula.",2021-07-30 13:24:21,2021-09-11 11:01:48,456,694,3
457,Donec posuere metus vitae ipsum. Aliquam non mauris.,2021-03-05 11:08:49,2021-08-16 00:36:42,457,933,97
458,In congue. Etiam justo. Etiam pretium iaculis justo.,2021-09-06 15:37:27,2021-04-25 19:17:08,458,952,33
459,Aenean sit amet justo. Morbi ut odio.,2021-11-07 13:39:03,2021-06-05 07:54:45,459,332,67
460,Morbi a ipsum. Integer a nibh.,2021-12-12 23:44:28,2021-06-20 20:41:28,460,263,75
461,Nulla suscipit ligula in lacus.,2021-06-14 07:29:44,2022-01-09 11:39:13,461,314,59
462,Integer a nibh. In quis justo.,2021-09-11 08:17:43,2021-03-07 15:53:42,462,523,57
463,"Mauris ullamcorper purus sit amet nulla. Quisque arcu libero, rutrum ac, lobortis vel, dapibus at, diam. Nam tristique tortor eu pede.",2021-02-18 04:19:23,2021-04-09 05:17:02,463,679,78
464,Nulla ac enim.,2021-11-04 18:14:57,2021-10-16 13:00:10,464,557,20
465,Suspendisse potenti. In eleifend quam a odio. In hac habitasse platea dictumst.,2021-10-07 15:29:56,2021-03-24 15:39:09,465,490,62
466,Nulla justo. Aliquam quis turpis eget elit sodales scelerisque. Mauris sit amet eros.,2021-12-10 18:10:15,2021-06-07 07:10:01,466,562,29
467,Vestibulum rutrum rutrum neque. Aenean auctor gravida sem. Praesent id massa id nisl venenatis lacinia.,2021-06-16 16:47:53,2021-08-30 13:04:51,467,239,22
468,"Donec diam neque, vestibulum eget, vulputate ut, ultrices vel, augue. Vestibulum ante ipsum primis in faucibus orci luctus et ultrices posuere cubilia Curae; Donec pharetra, magna vestibulum aliquet ultrices, erat tortor sollicitudin mi, sit amet lobortis sapien sapien non mi. Integer ac neque.",2021-05-28 04:39:17,2021-02-16 10:35:54,468,360,15
469,Donec semper sapien a libero. Nam dui.,2021-04-23 13:44:53,2021-12-12 23:07:05,469,324,1
470,"Integer aliquet, massa id lobortis convallis, tortor risus dapibus augue, vel accumsan tellus nisi eu orci.",2021-08-30 04:12:06,2021-05-09 16:36:06,470,101,50
471,Etiam vel augue. Vestibulum rutrum rutrum neque.,2021-05-13 20:51:30,2021-05-17 02:26:59,471,117,30
472,Nullam porttitor lacus at turpis. Donec posuere metus vitae ipsum.,2021-09-28 19:59:24,2021-06-03 23:26:19,472,791,2
473,"In sagittis dui vel nisl. Duis ac nibh. Fusce lacus purus, aliquet at, feugiat non, pretium quis, lectus.",2021-09-05 21:33:55,2021-10-27 23:45:55,473,521,57
474,"Morbi ut odio. Cras mi pede, malesuada in, imperdiet et, commodo vulputate, justo. In blandit ultrices enim.",2021-06-24 19:47:34,2021-05-06 16:12:44,474,51,21
475,In eleifend quam a odio. In hac habitasse platea dictumst.,2021-04-28 15:03:24,2021-06-16 12:57:05,475,104,53
476,"Vivamus metus arcu, adipiscing molestie, hendrerit at, vulputate vitae, nisl.",2021-01-27 10:04:30,2021-10-13 06:37:03,476,547,4
477,"Lorem ipsum dolor sit amet, consectetuer adipiscing elit.",2021-07-01 20:05:37,2021-11-04 10:32:02,477,454,44
478,"Vestibulum ante ipsum primis in faucibus orci luctus et ultrices posuere cubilia Curae; Donec pharetra, magna vestibulum aliquet ultrices, erat tortor sollicitudin mi, sit amet lobortis sapien sapien non mi.",2021-05-28 02:44:21,2021-03-06 00:38:23,478,145,95
479,Aliquam sit amet diam in magna bibendum imperdiet.,2021-03-20 19:29:51,2021-03-20 04:45:59,479,874,46
480,Mauris sit amet eros. Suspendisse accumsan tortor quis turpis. Sed ante.,2021-01-31 11:32:30,2021-03-13 01:37:29,480,446,51
481,Maecenas pulvinar lobortis est.,2021-06-02 21:01:27,2021-02-21 09:25:38,481,449,24
482,Suspendisse potenti.,2021-09-25 22:39:51,2021-02-02 01:48:20,482,888,39
483,"Duis ac nibh. Fusce lacus purus, aliquet at, feugiat non, pretium quis, lectus. Suspendisse potenti.",2021-03-09 03:23:59,2021-08-21 11:52:20,483,583,17
484,Nullam molestie nibh in lectus.,2021-09-06 19:13:06,2021-11-01 17:28:04,484,187,79
485,"In hac habitasse platea dictumst. Morbi vestibulum, velit id pretium iaculis, diam erat fermentum justo, nec condimentum neque sapien placerat ante.",2021-04-10 00:29:11,2021-07-14 07:12:41,485,351,22
486,Praesent blandit lacinia erat. Vestibulum sed magna at nunc commodo placerat. Praesent blandit.,2021-02-11 23:09:44,2021-12-11 12:02:25,486,811,29
487,Donec semper sapien a libero.,2021-12-08 20:18:48,2021-03-28 19:18:48,487,343,99
488,"Pellentesque ultrices mattis odio. Donec vitae nisi. Nam ultrices, libero non mattis pulvinar, nulla pede ullamcorper augue, a suscipit nulla elit ac nulla.",2021-12-14 21:27:22,2021-08-03 04:39:05,488,300,83
489,Integer ac neque. Duis bibendum.,2021-12-09 00:26:39,2021-02-15 00:31:14,489,488,50
490,"Mauris enim leo, rhoncus sed, vestibulum sit amet, cursus id, turpis. Integer aliquet, massa id lobortis convallis, tortor risus dapibus augue, vel accumsan tellus nisi eu orci. Mauris lacinia sapien quis libero.",2021-12-01 13:57:05,2021-05-21 04:23:07,490,579,93
491,"Duis at velit eu est congue elementum. In hac habitasse platea dictumst. Morbi vestibulum, velit id pretium iaculis, diam erat fermentum justo, nec condimentum neque sapien placerat ante.",2021-12-20 20:52:20,2021-12-11 22:13:16,491,682,37
492,"Integer non velit. Donec diam neque, vestibulum eget, vulputate ut, ultrices vel, augue. Vestibulum ante ipsum primis in faucibus orci luctus et ultrices posuere cubilia Curae; Donec pharetra, magna vestibulum aliquet ultrices, erat tortor sollicitudin mi, sit amet lobortis sapien sapien non mi.",2021-02-01 15:27:35,2021-06-01 23:36:40,492,309,93
493,Nulla tempus. Vivamus in felis eu sapien cursus vestibulum.,2021-08-15 11:59:59,2021-04-23 14:04:38,493,972,72
494,"Vestibulum ac est lacinia nisi venenatis tristique. Fusce congue, diam id ornare imperdiet, sapien urna pretium nisl, ut volutpat sapien arcu sed augue. Aliquam erat volutpat.",2021-05-09 03:53:19,2021-07-25 04:11:07,494,900,61
495,Phasellus in felis. Donec semper sapien a libero.,2021-05-11 03:04:19,2021-07-31 23:26:18,495,289,52
496,"Curabitur in libero ut massa volutpat convallis. Morbi odio odio, elementum eu, interdum eu, tincidunt in, leo. Maecenas pulvinar lobortis est.",2022-01-04 02:51:30,2021-03-06 11:34:59,496,540,38
497,"Lorem ipsum dolor sit amet, consectetuer adipiscing elit. Proin interdum mauris non ligula pellentesque ultrices. Phasellus id sapien in sapien iaculis congue.",2021-03-26 04:32:08,2021-05-31 02:00:43,497,832,81
498,"Cum sociis natoque penatibus et magnis dis parturient montes, nascetur ridiculus mus. Etiam vel augue. Vestibulum rutrum rutrum neque.",2022-01-07 14:22:23,2021-10-06 22:48:38,498,504,57
499,Fusce consequat. Nulla nisl. Nunc nisl.,2021-07-27 10:03:26,2021-06-29 06:20:20,499,677,79
500,Donec posuere metus vitae ipsum.,2021-10-27 13:20:04,2021-09-29 14:01:31,500,684,15
501,Donec dapibus. Duis at velit eu est congue elementum.,2021-06-04 18:01:03,2021-05-08 05:25:29,501,237,78
502,"Cum sociis natoque penatibus et magnis dis parturient montes, nascetur ridiculus mus.",2022-01-16 15:51:37,2021-10-16 08:31:52,502,242,85
503,Phasellus sit amet erat.,2021-02-04 00:11:14,2021-09-19 18:32:17,503,723,74
504,Suspendisse potenti.,2021-06-05 09:44:30,2021-02-20 12:53:35,504,486,77
505,"Maecenas tristique, est et tempus semper, est quam pharetra magna, ac consequat metus sapien ut nunc.",2021-11-17 20:45:23,2021-03-24 08:15:34,505,904,3
506,"Maecenas leo odio, condimentum id, luctus nec, molestie sed, justo. Pellentesque viverra pede ac diam.",2021-02-09 21:20:56,2021-12-16 17:27:18,506,742,13
507,"Praesent lectus. Vestibulum quam sapien, varius ut, blandit non, interdum in, ante.",2021-12-25 02:36:53,2021-04-28 04:05:09,507,112,14
508,Praesent blandit lacinia erat. Vestibulum sed magna at nunc commodo placerat. Praesent blandit.,2021-03-16 22:14:49,2021-05-23 07:44:16,508,825,1
509,Pellentesque viverra pede ac diam. Cras pellentesque volutpat dui.,2021-10-24 20:34:56,2021-05-08 10:18:55,509,201,30
510,Phasellus in felis. Donec semper sapien a libero.,2021-08-16 20:42:45,2022-01-17 23:18:44,510,207,63
511,Pellentesque eget nunc.,2021-04-12 07:28:18,2021-06-10 13:13:04,511,38,7
512,Integer ac neque. Duis bibendum.,2021-04-09 04:07:01,2021-03-01 08:54:38,512,969,48
513,Donec posuere metus vitae ipsum. Aliquam non mauris.,2021-04-20 16:00:56,2022-01-11 05:41:45,513,622,69
514,Suspendisse accumsan tortor quis turpis.,2021-10-07 20:31:05,2021-12-25 06:49:35,514,808,22
515,Donec ut dolor.,2021-12-16 13:26:53,2021-11-28 04:18:01,515,810,50
516,Integer tincidunt ante vel ipsum.,2021-09-06 19:40:19,2021-12-27 04:55:23,516,561,44
517,"Mauris enim leo, rhoncus sed, vestibulum sit amet, cursus id, turpis. Integer aliquet, massa id lobortis convallis, tortor risus dapibus augue, vel accumsan tellus nisi eu orci.",2021-08-19 17:57:26,2021-04-21 03:32:10,517,366,8
518,Nunc purus.,2021-02-14 22:12:09,2021-12-30 13:28:02,518,86,79
519,Nulla tellus.,2021-09-05 23:42:23,2021-03-20 11:12:15,519,918,25
520,Quisque id justo sit amet sapien dignissim vestibulum. Vestibulum ante ipsum primis in faucibus orci luctus et ultrices posuere cubilia Curae; Nulla dapibus dolor vel est.,2021-03-01 15:51:29,2021-03-27 05:43:44,520,752,58
521,Morbi vel lectus in quam fringilla rhoncus.,2021-05-10 12:45:04,2021-06-22 13:39:51,521,671,55
522,Integer ac neque. Duis bibendum. Morbi non quam nec dui luctus rutrum.,2021-06-15 02:15:04,2021-10-18 03:31:49,522,643,54
523,Nulla tempus. Vivamus in felis eu sapien cursus vestibulum.,2021-11-17 18:36:37,2021-12-14 06:35:47,523,438,33
524,Vivamus vel nulla eget eros elementum pellentesque.,2021-02-07 05:37:54,2021-11-11 08:05:53,524,63,34
525,"Donec odio justo, sollicitudin ut, suscipit a, feugiat et, eros.",2021-08-13 18:27:19,2021-05-18 17:03:37,525,479,25
526,"Donec odio justo, sollicitudin ut, suscipit a, feugiat et, eros. Vestibulum ac est lacinia nisi venenatis tristique. Fusce congue, diam id ornare imperdiet, sapien urna pretium nisl, ut volutpat sapien arcu sed augue.",2021-12-09 13:23:55,2021-07-08 03:26:27,526,926,76
527,Vestibulum ante ipsum primis in faucibus orci luctus et ultrices posuere cubilia Curae; Mauris viverra diam vitae quam.,2021-08-03 05:10:54,2021-07-13 00:00:05,527,540,11
528,"Mauris ullamcorper purus sit amet nulla. Quisque arcu libero, rutrum ac, lobortis vel, dapibus at, diam. Nam tristique tortor eu pede.",2021-03-28 16:39:34,2021-02-10 21:39:55,528,381,28
529,"Vivamus metus arcu, adipiscing molestie, hendrerit at, vulputate vitae, nisl. Aenean lectus.",2021-09-25 05:23:57,2021-08-28 10:30:41,529,240,11
530,"Nunc rhoncus dui vel sem. Sed sagittis. Nam congue, risus semper porta volutpat, quam pede lobortis ligula, sit amet eleifend pede libero quis orci.",2021-06-02 05:25:39,2021-04-11 06:41:15,530,348,35
531,Nunc purus.,2021-11-13 22:24:05,2021-08-17 09:35:22,531,229,98
532,"In hac habitasse platea dictumst. Morbi vestibulum, velit id pretium iaculis, diam erat fermentum justo, nec condimentum neque sapien placerat ante.",2021-10-02 00:36:12,2021-03-02 15:45:24,532,368,92
533,Vestibulum rutrum rutrum neque. Aenean auctor gravida sem. Praesent id massa id nisl venenatis lacinia.,2021-06-13 17:29:46,2021-07-17 02:00:07,533,264,51
534,In eleifend quam a odio. In hac habitasse platea dictumst.,2021-05-13 08:58:53,2021-02-04 20:51:09,534,516,42
535,"Cras mi pede, malesuada in, imperdiet et, commodo vulputate, justo.",2021-09-02 04:12:19,2021-05-17 10:08:29,535,590,92
536,Mauris lacinia sapien quis libero.,2021-05-10 04:43:42,2021-02-01 13:34:56,536,549,16
537,Integer ac neque. Duis bibendum.,2021-10-24 08:07:07,2022-01-18 08:47:03,537,32,29
538,Etiam justo.,2021-10-23 17:25:35,2021-08-31 14:20:08,538,673,84
539,Integer ac neque. Duis bibendum. Morbi non quam nec dui luctus rutrum.,2021-11-02 07:38:04,2021-05-03 05:38:04,539,833,39
540,In congue. Etiam justo.,2021-08-13 03:58:37,2021-03-20 10:57:13,540,902,32
541,"Cum sociis natoque penatibus et magnis dis parturient montes, nascetur ridiculus mus. Vivamus vestibulum sagittis sapien.",2021-10-16 10:41:34,2021-07-13 04:06:20,541,594,50
542,"Aenean sit amet justo. Morbi ut odio. Cras mi pede, malesuada in, imperdiet et, commodo vulputate, justo.",2021-04-20 21:43:44,2021-08-30 04:48:48,542,839,1
543,"Aliquam augue quam, sollicitudin vitae, consectetuer eget, rutrum at, lorem. Integer tincidunt ante vel ipsum. Praesent blandit lacinia erat.",2021-11-24 06:44:33,2021-11-07 09:15:19,543,967,85
544,Curabitur in libero ut massa volutpat convallis.,2021-08-08 09:58:54,2021-05-25 13:02:33,544,867,32
545,"Donec diam neque, vestibulum eget, vulputate ut, ultrices vel, augue.",2021-04-18 23:19:31,2021-07-27 05:25:48,545,753,70
546,Etiam justo. Etiam pretium iaculis justo. In hac habitasse platea dictumst.,2021-06-16 17:25:41,2021-06-15 23:31:25,546,312,64
547,Nulla mollis molestie lorem. Quisque ut erat.,2021-12-27 19:05:50,2021-09-28 06:52:25,547,648,69
548,"Praesent lectus. Vestibulum quam sapien, varius ut, blandit non, interdum in, ante. Vestibulum ante ipsum primis in faucibus orci luctus et ultrices posuere cubilia Curae; Duis faucibus accumsan odio.",2021-09-10 06:48:34,2021-04-19 12:14:14,548,605,10
549,Nulla nisl. Nunc nisl.,2021-05-20 00:44:32,2021-05-18 13:24:11,549,838,25
550,Vestibulum ante ipsum primis in faucibus orci luctus et ultrices posuere cubilia Curae; Nulla dapibus dolor vel est.,2021-10-12 08:18:25,2021-06-24 01:13:48,550,593,62
551,"Cras mi pede, malesuada in, imperdiet et, commodo vulputate, justo.",2021-09-12 04:06:59,2021-07-15 19:04:54,551,173,86
552,Nulla facilisi. Cras non velit nec nisi vulputate nonummy.,2021-05-09 10:28:00,2022-01-03 01:41:43,552,333,96
553,"Aenean fermentum. Donec ut mauris eget massa tempor convallis. Nulla neque libero, convallis eget, eleifend luctus, ultricies eu, nibh.",2021-11-20 19:53:52,2022-01-12 01:21:39,553,318,51
554,Nulla nisl. Nunc nisl.,2021-05-18 00:31:56,2021-08-10 00:05:49,554,816,90
555,"Praesent blandit. Nam nulla. Integer pede justo, lacinia eget, tincidunt eget, tempus vel, pede.",2022-01-25 04:33:12,2022-01-25 12:09:00,555,330,30
556,Aliquam quis turpis eget elit sodales scelerisque.,2021-11-07 14:09:30,2021-07-18 18:51:31,556,22,53
557,Donec ut mauris eget massa tempor convallis.,2021-11-08 14:37:57,2021-08-10 05:26:12,557,140,25
558,"Pellentesque viverra pede ac diam. Cras pellentesque volutpat dui. Maecenas tristique, est et tempus semper, est quam pharetra magna, ac consequat metus sapien ut nunc.",2021-07-29 09:52:59,2021-08-03 07:52:34,558,238,12
559,Etiam pretium iaculis justo. In hac habitasse platea dictumst. Etiam faucibus cursus urna.,2021-07-14 20:43:57,2021-04-05 06:16:44,559,344,49
560,Etiam faucibus cursus urna. Ut tellus.,2021-03-17 16:14:19,2021-03-04 00:10:19,560,671,67
561,Cras pellentesque volutpat dui.,2021-09-05 22:33:19,2021-07-11 15:07:08,561,266,2
