739,In quis justo. Maecenas rhoncus aliquam lacus. Morbi quis tortor id nulla ultrices aliquet.,2022-01-02 06:18:41,2021-11-09 13:22:30,null,229,68
740,Donec vitae nisi.,2021-08-08 01:31:13,2021-04-23 04:46:41,null,567,64
741,Vivamus in felis eu sapien cursus vestibulum. Proin eu mi. Nulla ac enim.,2021-07-04 12:23:35,2022-01-16 18:37:06,null,788,37
742,Donec quis orci eget orci vehicula condimentum.,2021-07-05 12:21:51,2021-10-11 05:34:23,null,355,48
743,"Morbi quis tortor id nulla ultrices aliquet. Maecenas leo odio, condimentum id, luctus nec, molestie sed, justo. Pellentesque viverra pede ac diam.",2021-07-23 10:10:15,2021-03-07 00:09:34,null,927,76
744,Ut tellus.,2021-07-05 02:22:15,2021-05-12 23:46:37,null,370,58
745,Sed accumsan felis.,2021-11-13 14:44:35,2021-12-14 22:20:56,null,58,93
746,"Nulla neque libero, convallis eget, eleifend luctus, ultricies eu, nibh.",2021-02-22 17:47:36,2021-04-16 16:52:13,null,457,68
747,"Aliquam augue quam, sollicitudin vitae, consectetuer eget, rutrum at, lorem.",2021-09-17 04:12:36,2021-02-16 14:49:42,null,292,11
748,Vestibulum ante ipsum primis in faucibus orci luctus et ultrices posuere cubilia Curae; Mauris viverra diam vitae quam. Suspendisse potenti. Nullam porttitor lacus at turpis.,2021-02-04 07:24:18,2021-03-27 23:53:56,null,854,50
749,Nullam porttitor lacus at turpis. Donec posuere metus vitae ipsum. Aliquam non mauris.,2021-07-21 15:26:46,2022-01-06 14:38:36,null,250,14
750,Fusce consequat.,2021-04-30 09:58:05,2021-04-27 03:21:12,null,143,15
751,Vivamus in felis eu sapien cursus vestibulum. Proin eu mi. Nulla ac enim.,2021-02-02 13:08:27,2021-08-23 18:32:11,null,740,70
752,"Aliquam sit amet diam in magna bibendum imperdiet. Nullam orci pede, venenatis non, sodales sed, tincidunt eu, felis.",2021-04-20 01:34:37,2021-04-08 14:54:32,null,707,85
753,Nulla nisl. Nunc nisl.,2022-01-19 23:34:18,2021-07-07 09:25:16,null,956,64
754,Donec vitae nisi.,2021-05-07 03:57:05,2021-03-28 06:29:11,null,375,47
755,"Praesent blandit. Nam nulla. Integer pede justo, lacinia eget, tincidunt eget, tempus vel, pede.",2021-05-24 01:19:07,2021-02-12 15:26:16,null,352,86
756,Suspendisse potenti.,2022-01-24 04:36:51,2021-10-06 00:18:00,null,157,85
757,Duis aliquam convallis nunc.,2021-01-27 01:42:26,2021-04-02 08:54:55,null,435,5
758,Maecenas pulvinar lobortis est. Phasellus sit amet erat. Nulla tempus.,2021-11-13 10:18:09,2021-09-26 13:44:50,null,36,48
759,"Cum sociis natoque penatibus et magnis dis parturient montes, nascetur ridiculus mus. Etiam vel augue. Vestibulum rutrum rutrum neque.",2021-10-02 02:48:22,2021-02-16 00:40:38,null,922,60
760,Maecenas rhoncus aliquam lacus.,2021-12-03 18:47:12,2021-09-06 00:36:43,null,508,30
761,Fusce consequat. Nulla nisl. Nunc nisl.,2021-07-07 21:48:23,2021-09-03 20:57:04,null,685,11
762,Morbi non quam nec dui luctus rutrum. Nulla tellus.,2021-12-31 11:31:02,2021-11-04 10:12:37,null,454,65
763,Aenean lectus.,2021-10-16 13:08:49,2021-02-12 10:54:25,null,103,98
764,"Nam ultrices, libero non mattis pulvinar, nulla pede ullamcorper augue, a suscipit nulla elit ac nulla. Sed vel enim sit amet nunc viverra dapibus. Nulla suscipit ligula in lacus.",2021-12-26 04:08:15,2021-05-31 20:45:31,null,646,44
765,Aenean lectus.,2021-07-06 05:24:44,2021-05-05 07:13:00,null,945,51
766,"Morbi vel lectus in quam fringilla rhoncus. Mauris enim leo, rhoncus sed, vestibulum sit amet, cursus id, turpis. Integer aliquet, massa id lobortis convallis, tortor risus dapibus augue, vel accumsan tellus nisi eu orci.",2021-07-30 22:49:11,2021-04-14 14:35:32,null,809,71
767,Sed vel enim sit amet nunc viverra dapibus. Nulla suscipit ligula in lacus. Curabitur at ipsum ac tellus semper interdum.,2021-08-05 21:23:06,2021-11-06 17:32:38,null,37,53
768,Praesent id massa id nisl venenatis lacinia. Aenean sit amet justo.,2021-11-03 06:16:11,2021-11-11 23:53:53,null,170,80
769,Curabitur convallis. Duis consequat dui nec nisi volutpat eleifend.,2021-07-16 14:46:05,2021-03-16 17:19:47,null,602,94
770,"Fusce lacus purus, aliquet at, feugiat non, pretium quis, lectus.",2022-01-20 11:05:47,2021-08-05 19:45:03,null,210,16
771,In hac habitasse platea dictumst. Maecenas ut massa quis augue luctus tincidunt. Nulla mollis molestie lorem.,2021-10-31 20:18:24,2021-06-26 02:01:42,null,231,49
772,Donec ut dolor. Morbi vel lectus in quam fringilla rhoncus.,2021-10-07 01:22:33,2021-08-09 05:06:50,null,969,59
773,"In est risus, auctor sed, tristique in, tempus sit amet, sem. Fusce consequat. Nulla nisl.",2021-04-09 16:00:07,2021-07-28 09:15:19,null,239,9
774,Mauris lacinia sapien quis libero. Nullam sit amet turpis elementum ligula vehicula consequat. Morbi a ipsum.,2021-10-16 23:35:26,2021-06-06 07:21:04,null,424,82
775,Curabitur at ipsum ac tellus semper interdum. Mauris ullamcorper purus sit amet nulla.,2021-06-30 19:46:16,2021-09-20 07:52:27,null,320,57
776,Donec dapibus.,2021-11-25 20:19:11,2022-01-23 11:08:56,null,512,9
777,Nulla tellus. In sagittis dui vel nisl.,2021-02-27 19:16:05,2021-06-13 07:37:14,null,33,80
778,Nulla ut erat id mauris vulputate elementum. Nullam varius.,2021-04-25 15:39:06,2021-08-09 20:55:57,null,522,18
779,Quisque ut erat. Curabitur gravida nisi at nibh. In hac habitasse platea dictumst.,2021-03-27 00:32:46,2021-04-21 18:23:51,null,108,2
780,"In tempor, turpis nec euismod scelerisque, quam turpis adipiscing lorem, vitae mattis nibh ligula nec sem.",2021-11-19 06:32:34,2021-10-22 05:31:32,null,454,8
781,Aliquam quis turpis eget elit sodales scelerisque. Mauris sit amet eros.,2021-09-25 02:15:09,2021-02-09 01:25:52,null,24,32
782,"Praesent lectus. Vestibulum quam sapien, varius ut, blandit non, interdum in, ante.",2021-07-26 23:07:45,2021-09-04 14:25:09,null,613,52
783,"Integer pede justo, lacinia eget, tincidunt eget, tempus vel, pede.",2021-07-06 23:51:57,2021-09-08 14:33:18,null,118,56
784,"Morbi vel lectus in quam fringilla rhoncus. Mauris enim leo, rhoncus sed, vestibulum sit amet, cursus id, turpis. Integer aliquet, massa id lobortis convallis, tortor risus dapibus augue, vel accumsan tellus nisi eu orci.",2022-01-20 21:41:12,2021-08-03 18:41:18,null,24,65
785,"Cras mi pede, malesuada in, imperdiet et, commodo vulputate, justo.",2021-02-23 05:38:51,2021-10-23 10:00:05,null,671,27
786,Nulla nisl. Nunc nisl.,2021-03-17 17:10:54,2022-01-22 23:07:15,null,948,99
787,Praesent blandit. Nam nulla.,2021-11-02 17:06:54,2021-10-06 03:03:40,null,824,10
788,"Cum sociis natoque penatibus et magnis dis parturient montes, nascetur ridiculus mus.",2021-06-07 22:05:04,2021-06-20 17:40:00,null,458,60
789,Aenean lectus. Pellentesque eget nunc. Donec quis orci eget orci vehicula condimentum.,2021-12-02 04:51:35,2022-01-07 21:09:08,null,427,37
790,"Donec odio justo, sollicitudin ut, suscipit a, feugiat et, eros. Vestibulum ac est lacinia nisi venenatis tristique. Fusce congue, diam id ornare imperdiet, sapien urna pretium nisl, ut volutpat sapien arcu sed augue.",2021-09-04 03:44:31,2022-01-17 07:55:51,null,148,41
791,In hac habitasse platea dictumst.,2021-12-31 15:24:33,2021-07-05 21:22:50,null,958,90
792,"Aenean sit amet justo. Morbi ut odio. Cras mi pede, malesuada in, imperdiet et, commodo vulputate, justo.",2021-08-29 20:57:14,2021-08-05 03:53:00,null,537,2
793,"In blandit ultrices enim. Lorem ipsum dolor sit amet, consectetuer adipiscing elit. Proin interdum mauris non ligula pellentesque ultrices.",2021-11-21 04:04:17,2021-12-23 16:49:29,null,118,70
794,Maecenas tincidunt lacus at velit.,2021-08-07 22:11:54,2021-06-02 15:23:06,null,127,21
795,"Quisque id justo sit amet sapien dignissim vestibulum. Vestibulum ante ipsum primis in faucibus orci luctus et ultrices posuere cubilia Curae; Nulla dapibus dolor vel est. Donec odio justo, sollicitudin ut, suscipit a, feugiat et, eros.",2021-02-02 16:46:55,2021-04-11 03:02:59,null,33,7
796,"Duis bibendum, felis sed interdum venenatis, turpis enim blandit mi, in porttitor pede justo eu massa.",2021-09-17 14:02:29,2021-08-22 20:41:53,null,84,75
797,"Vivamus vestibulum sagittis sapien. Cum sociis natoque penatibus et magnis dis parturient montes, nascetur ridiculus mus. Etiam vel augue.",2021-12-17 04:31:39,2021-03-13 16:41:36,null,646,8
798,Duis bibendum. Morbi non quam nec dui luctus rutrum. Nulla tellus.,2021-05-26 07:28:56,2021-09-21 16:28:42,null,405,71
799,"Morbi ut odio. Cras mi pede, malesuada in, imperdiet et, commodo vulputate, justo. In blandit ultrices enim.",2021-05-10 10:29:39,2021-10-22 10:05:39,null,352,60
800,Aenean fermentum. Donec ut mauris eget massa tempor convallis.,2021-05-27 00:48:00,2021-02-14 06:49:45,null,10,2
801,"Vivamus metus arcu, adipiscing molestie, hendrerit at, vulputate vitae, nisl. Aenean lectus.",2021-09-06 17:08:56,2021-02-16 10:35:43,null,620,1
802,In hac habitasse platea dictumst. Maecenas ut massa quis augue luctus tincidunt. Nulla mollis molestie lorem.,2021-06-21 16:02:15,2021-09-14 05:19:00,null,509,73
803,Integer tincidunt ante vel ipsum. Praesent blandit lacinia erat.,2022-01-04 02:53:42,2021-07-29 12:25:49,null,754,60
804,Maecenas pulvinar lobortis est. Phasellus sit amet erat.,2021-04-27 17:27:27,2022-01-23 00:54:39,null,215,11
805,Curabitur in libero ut massa volutpat convallis.,2021-07-01 22:45:43,2021-04-15 12:29:19,null,346,93
806,"Proin eu mi. Nulla ac enim. In tempor, turpis nec euismod scelerisque, quam turpis adipiscing lorem, vitae mattis nibh ligula nec sem.",2022-01-04 09:34:03,2021-09-27 03:58:43,null,863,95
807,Aliquam erat volutpat. In congue.,2021-09-09 17:14:59,2021-05-05 20:52:21,null,98,84
808,"Morbi non lectus. Aliquam sit amet diam in magna bibendum imperdiet. Nullam orci pede, venenatis non, sodales sed, tincidunt eu, felis.",2021-07-22 13:57:22,2021-04-18 00:48:22,null,303,86
809,Praesent blandit. Nam nulla.,2021-11-30 12:13:26,2021-03-07 11:17:21,null,552,7
810,Proin at turpis a pede posuere nonummy.,2021-12-08 14:12:14,2021-12-08 20:40:10,null,482,32
811,Cras non velit nec nisi vulputate nonummy.,2021-12-21 05:02:56,2021-10-09 03:45:17,null,929,80
812,Donec semper sapien a libero.,2021-08-20 03:29:20,2021-11-12 14:56:50,null,800,29
813,Integer ac neque. Duis bibendum. Morbi non quam nec dui luctus rutrum.,2021-03-17 05:12:15,2021-03-21 02:27:32,null,153,1
814,Nulla tempus. Vivamus in felis eu sapien cursus vestibulum. Proin eu mi.,2021-01-26 05:48:02,2021-11-01 20:54:08,null,79,52
815,Pellentesque eget nunc. Donec quis orci eget orci vehicula condimentum. Curabitur in libero ut massa volutpat convallis.,2021-12-17 07:27:42,2021-08-17 11:48:47,null,517,59
816,Aliquam non mauris. Morbi non lectus. Aliquam sit amet diam in magna bibendum imperdiet.,2021-12-27 15:40:50,2021-11-22 18:30:21,null,376,35
817,"Mauris ullamcorper purus sit amet nulla. Quisque arcu libero, rutrum ac, lobortis vel, dapibus at, diam. Nam tristique tortor eu pede.",2021-08-05 20:04:41,2021-05-02 15:48:09,null,740,54
818,"Donec quis orci eget orci vehicula condimentum. Curabitur in libero ut massa volutpat convallis. Morbi odio odio, elementum eu, interdum eu, tincidunt in, leo.",2021-09-08 03:26:41,2021-06-19 20:59:10,null,645,84
819,Duis aliquam convallis nunc. Proin at turpis a pede posuere nonummy.,2021-04-01 14:16:50,2021-07-05 03:04:09,null,68,15
820,Nulla ut erat id mauris vulputate elementum. Nullam varius. Nulla facilisi.,2021-11-15 10:59:36,2021-01-27 05:44:56,null,541,51
821,"Morbi odio odio, elementum eu, interdum eu, tincidunt in, leo. Maecenas pulvinar lobortis est.",2021-09-19 16:03:32,2021-12-21 20:07:06,null,983,48
822,Morbi non quam nec dui luctus rutrum. Nulla tellus. In sagittis dui vel nisl.,2021-10-30 11:38:19,2021-03-30 15:28:44,null,320,9
823,"Vivamus metus arcu, adipiscing molestie, hendrerit at, vulputate vitae, nisl. Aenean lectus. Pellentesque eget nunc.",2021-05-11 11:37:44,2021-03-13 06:43:32,null,247,54
824,Nulla ut erat id mauris vulputate elementum. Nullam varius. Nulla facilisi.,2021-03-08 12:58:06,2021-09-25 23:28:56,null,345,92
825,"Duis ac nibh. Fusce lacus purus, aliquet at, feugiat non, pretium quis, lectus.",2021-10-06 08:08:08,2021-05-21 23:02:32,null,887,17
826,"Lorem ipsum dolor sit amet, consectetuer adipiscing elit. Proin risus. Praesent lectus.",2021-10-03 13:12:00,2021-03-06 04:38:06,null,413,69
827,Donec dapibus.,2021-10-07 01:20:41,2021-11-10 04:49:55,null,674,6
828,"Vivamus vestibulum sagittis sapien. Cum sociis natoque penatibus et magnis dis parturient montes, nascetur ridiculus mus.",2021-02-16 03:09:41,2021-06-21 22:27:28,null,58,8
829,Etiam vel augue. Vestibulum rutrum rutrum neque.,2021-04-06 22:33:20,2021-12-18 23:26:09,null,136,36
830,Vestibulum sed magna at nunc commodo placerat. Praesent blandit.,2021-03-20 04:07:01,2021-08-25 15:36:44,null,476,32
831,Integer a nibh. In quis justo. Maecenas rhoncus aliquam lacus.,2021-12-28 16:59:41,2021-03-08 18:14:38,null,110,24
832,Sed vel enim sit amet nunc viverra dapibus.,2021-07-28 17:33:02,2021-12-04 00:02:29,null,891,46
833,Etiam faucibus cursus urna.,2021-10-29 14:48:34,2021-02-11 03:53:33,null,929,94
834,Integer ac leo.,2021-07-09 23:57:40,2021-06-18 10:57:53,null,130,41
835,"Morbi porttitor lorem id ligula. Suspendisse ornare consequat lectus. In est risus, auctor sed, tristique in, tempus sit amet, sem.",2021-05-20 16:24:24,2021-05-13 14:06:15,null,212,28
836,Quisque porta volutpat erat.,2021-02-10 14:57:47,2021-12-22 11:06:29,null,942,75
837,Curabitur in libero ut massa volutpat convallis.,2021-04-17 20:47:27,2021-03-04 20:30:52,null,577,60
838,"Lorem ipsum dolor sit amet, consectetuer adipiscing elit. Proin interdum mauris non ligula pellentesque ultrices.",2021-12-05 08:13:05,2021-06-03 18:16:30,null,884,6
839,"In est risus, auctor sed, tristique in, tempus sit amet, sem. Fusce consequat.",2021-05-25 21:09:36,2022-01-03 22:16:27,null,16,65
840,"Cras in purus eu magna vulputate luctus. Cum sociis natoque penatibus et magnis dis parturient montes, nascetur ridiculus mus. Vivamus vestibulum sagittis sapien.",2021-09-27 17:57:52,2021-06-25 13:44:32,null,795,36
841,Integer ac neque. Duis bibendum.,2021-07-19 04:37:00,2021-08-27 02:15:39,null,611,60
842,"In hac habitasse platea dictumst. Aliquam augue quam, sollicitudin vitae, consectetuer eget, rutrum at, lorem. Integer tincidunt ante vel ipsum.",2021-10-23 04:07:19,2021-02-15 02:28:42,null,571,6
843,Donec quis orci eget orci vehicula condimentum. Curabitur in libero ut massa volutpat convallis.,2021-02-21 08:06:26,2021-05-27 14:00:57,null,66,30
844,Nulla mollis molestie lorem.,2021-08-16 15:32:20,2021-02-23 08:09:40,null,780,37
845,"Nullam orci pede, venenatis non, sodales sed, tincidunt eu, felis.",2021-11-11 15:25:00,2021-12-07 04:47:49,null,595,73
846,"Sed sagittis. Nam congue, risus semper porta volutpat, quam pede lobortis ligula, sit amet eleifend pede libero quis orci.",2021-12-13 08:13:02,2021-12-22 03:06:49,null,642,44
847,In hac habitasse platea dictumst. Etiam faucibus cursus urna.,2021-03-24 16:38:38,2021-03-17 16:00:44,null,642,42
848,Donec ut mauris eget massa tempor convallis.,2021-06-20 05:12:46,2021-09-20 19:30:54,null,980,86
849,Etiam faucibus cursus urna.,2021-03-31 02:13:05,2021-08-09 12:29:38,null,188,78
850,Aliquam erat volutpat. In congue. Etiam justo.,2021-09-25 10:28:18,2021-06-28 07:19:54,null,435,5
851,Vestibulum ante ipsum primis in faucibus orci luctus et ultrices posuere cubilia Curae; Duis faucibus accumsan odio. Curabitur convallis.,2021-11-18 15:51:34,2021-05-21 11:58:08,null,848,95
852,Duis bibendum.,2021-03-08 02:24:31,2021-08-24 14:07:28,null,683,5
853,Nullam molestie nibh in lectus.,2021-06-26 19:04:40,2021-10-27 02:40:10,null,16,88
854,Donec quis orci eget orci vehicula condimentum.,2021-04-18 10:43:46,2021-08-17 13:14:20,null,832,92
855,In sagittis dui vel nisl. Duis ac nibh.,2021-07-26 08:00:59,2022-01-02 10:15:30,null,293,8
856,Proin interdum mauris non ligula pellentesque ultrices. Phasellus id sapien in sapien iaculis congue.,2021-05-04 20:21:38,2021-12-16 23:59:22,null,697,85
857,Donec ut dolor.,2022-01-15 13:23:54,2021-10-07 18:51:37,null,855,66
858,Phasellus id sapien in sapien iaculis congue.,2021-03-01 17:46:12,2021-09-19 06:28:18,null,276,93
859,Cras in purus eu magna vulputate luctus.,2021-05-06 21:59:08,2021-09-14 20:09:13,null,143,40
860,Aenean lectus. Pellentesque eget nunc. Donec quis orci eget orci vehicula condimentum.,2021-07-10 15:21:14,2021-09-18 13:59:20,null,435,58
861,Praesent blandit lacinia erat. Vestibulum sed magna at nunc commodo placerat.,2021-02-10 22:33:41,2021-07-16 08:04:25,null,728,45
862,Nulla ut erat id mauris vulputate elementum. Nullam varius. Nulla facilisi.,2021-08-14 03:02:43,2021-09-29 15:26:51,null,938,80
863,In hac habitasse platea dictumst.,2021-02-22 11:56:33,2021-11-03 20:51:33,null,274,7
864,Nulla tempus.,2021-05-25 15:16:51,2021-12-09 00:01:03,null,499,37
865,"Morbi vel lectus in quam fringilla rhoncus. Mauris enim leo, rhoncus sed, vestibulum sit amet, cursus id, turpis.",2021-09-13 11:10:25,2022-01-25 15:16:58,null,400,77
866,"Aliquam augue quam, sollicitudin vitae, consectetuer eget, rutrum at, lorem.",2021-08-09 05:51:36,2021-09-25 14:14:34,null,79,52
867,"Vivamus metus arcu, adipiscing molestie, hendrerit at, vulputate vitae, nisl. Aenean lectus.",2021-04-10 19:40:56,2021-07-23 14:26:16,null,214,17
868,"Vivamus metus arcu, adipiscing molestie, hendrerit at, vulputate vitae, nisl. Aenean lectus.",2021-11-28 14:37:48,2021-08-15 14:59:35,null,700,42
869,"Nam ultrices, libero non mattis pulvinar, nulla pede ullamcorper augue, a suscipit nulla elit ac nulla. Sed vel enim sit amet nunc viverra dapibus. Nulla suscipit ligula in lacus.",2022-01-20 00:41:09,2021-11-29 19:45:30,null,13,3
870,Nulla suscipit ligula in lacus. Curabitur at ipsum ac tellus semper interdum.,2021-02-15 00:14:05,2022-01-08 08:08:41,null,337,73
871,Vivamus vel nulla eget eros elementum pellentesque. Quisque porta volutpat erat.,2021-11-23 07:29:31,2021-04-06 14:35:33,null,400,43
872,Nulla facilisi. Cras non velit nec nisi vulputate nonummy.,2021-06-08 19:30:36,2021-07-21 16:17:58,null,241,73
873,Praesent blandit lacinia erat. Vestibulum sed magna at nunc commodo placerat.,2021-02-22 07:34:03,2021-08-17 20:17:09,null,29,4
874,Cras non velit nec nisi vulputate nonummy.,2021-05-17 13:19:24,2021-09-10 17:28:34,null,600,5
875,Ut at dolor quis odio consequat varius. Integer ac leo.,2021-12-30 21:40:37,2021-02-26 14:55:00,null,416,3
876,"Integer non velit. Donec diam neque, vestibulum eget, vulputate ut, ultrices vel, augue.",2021-03-26 12:18:01,2021-08-26 11:10:05,null,357,7
877,"Nam congue, risus semper porta volutpat, quam pede lobortis ligula, sit amet eleifend pede libero quis orci.",2021-10-23 22:41:18,2021-11-28 12:34:55,null,959,8
878,"Nullam orci pede, venenatis non, sodales sed, tincidunt eu, felis. Fusce posuere felis sed lacus. Morbi sem mauris, laoreet ut, rhoncus aliquet, pulvinar sed, nisl.",2021-10-17 18:16:10,2021-05-21 04:46:23,null,555,78
879,"Donec odio justo, sollicitudin ut, suscipit a, feugiat et, eros. Vestibulum ac est lacinia nisi venenatis tristique. Fusce congue, diam id ornare imperdiet, sapien urna pretium nisl, ut volutpat sapien arcu sed augue.",2021-05-21 23:35:32,2021-03-01 00:46:50,null,119,36
880,"Praesent blandit. Nam nulla. Integer pede justo, lacinia eget, tincidunt eget, tempus vel, pede.",2022-01-10 09:35:14,2021-02-07 11:51:06,null,818,73
881,Nulla ut erat id mauris vulputate elementum.,2022-01-13 03:45:39,2021-05-12 07:08:29,null,960,67
882,In hac habitasse platea dictumst.,2021-12-07 13:33:23,2021-04-22 07:17:26,null,600,16
883,"Nam dui. Proin leo odio, porttitor id, consequat in, consequat ut, nulla.",2021-11-06 10:32:55,2021-07-06 05:28:43,null,541,82
884,Duis bibendum.,2021-02-13 05:17:42,2021-04-03 10:49:21,null,648,21
885,"In hac habitasse platea dictumst. Morbi vestibulum, velit id pretium iaculis, diam erat fermentum justo, nec condimentum neque sapien placerat ante.",2021-07-18 22:08:01,2021-11-16 12:50:23,null,707,94
886,"Nulla ac enim. In tempor, turpis nec euismod scelerisque, quam turpis adipiscing lorem, vitae mattis nibh ligula nec sem.",2021-06-04 03:37:44,2021-04-21 18:24:34,null,148,62
887,Pellentesque viverra pede ac diam.,2021-12-20 09:05:05,2021-08-21 17:18:12,null,846,75
888,Vestibulum ante ipsum primis in faucibus orci luctus et ultrices posuere cubilia Curae; Mauris viverra diam vitae quam.,2021-08-18 14:53:04,2021-10-02 15:14:43,null,164,77
889,Nam dui.,2021-12-05 06:18:40,2021-04-30 03:36:31,null,854,7
890,Aenean lectus.,2022-01-15 04:15:17,2021-07-17 18:14:12,null,415,85
891,"Maecenas rhoncus aliquam lacus. Morbi quis tortor id nulla ultrices aliquet. Maecenas leo odio, condimentum id, luctus nec, molestie sed, justo.",2021-06-02 11:03:40,2021-08-23 19:13:34,null,206,96
892,Nullam molestie nibh in lectus.,2021-09-28 11:35:37,2021-03-30 02:20:30,null,503,18
893,"Duis bibendum, felis sed interdum venenatis, turpis enim blandit mi, in porttitor pede justo eu massa. Donec dapibus.",2021-05-30 10:41:03,2021-09-12 22:34:02,null,365,51
894,Mauris ullamcorper purus sit amet nulla.,2021-03-16 17:10:53,2021-10-13 07:42:01,null,906,73
895,Suspendisse potenti. Nullam porttitor lacus at turpis. Donec posuere metus vitae ipsum.,2021-09-19 23:11:30,2021-06-10 03:34:17,null,693,38
896,"Donec vitae nisi. Nam ultrices, libero non mattis pulvinar, nulla pede ullamcorper augue, a suscipit nulla elit ac nulla. Sed vel enim sit amet nunc viverra dapibus.",2021-05-18 07:29:01,2021-11-21 02:14:24,null,17,26
897,Integer tincidunt ante vel ipsum. Praesent blandit lacinia erat.,2021-10-22 02:43:45,2021-09-10 10:35:58,null,346,20
898,Etiam justo. Etiam pretium iaculis justo.,2021-09-20 02:03:38,2021-10-14 05:58:29,null,218,64
899,Nulla mollis molestie lorem.,2022-01-25 02:52:21,2021-12-28 15:12:05,null,406,41
900,"In hac habitasse platea dictumst. Morbi vestibulum, velit id pretium iaculis, diam erat fermentum justo, nec condimentum neque sapien placerat ante. Nulla justo.",2021-03-02 07:07:10,2021-05-21 18:45:49,null,540,31
901,Mauris lacinia sapien quis libero. Nullam sit amet turpis elementum ligula vehicula consequat.,2021-08-31 22:36:15,2021-02-03 21:56:28,null,622,17
902,Phasellus in felis. Donec semper sapien a libero.,2021-06-13 07:25:21,2021-07-12 11:05:27,null,697,13
903,"Duis at velit eu est congue elementum. In hac habitasse platea dictumst. Morbi vestibulum, velit id pretium iaculis, diam erat fermentum justo, nec condimentum neque sapien placerat ante.",2021-05-06 12:16:49,2021-12-29 20:39:14,null,549,6
904,Etiam vel augue. Vestibulum rutrum rutrum neque.,2021-10-12 11:22:31,2021-06-03 09:12:51,null,759,62
905,Morbi non lectus. Aliquam sit amet diam in magna bibendum imperdiet.,2021-07-06 06:21:35,2021-06-16 13:09:35,null,706,87
906,"Nam ultrices, libero non mattis pulvinar, nulla pede ullamcorper augue, a suscipit nulla elit ac nulla.",2021-05-03 09:37:42,2021-11-13 10:15:03,null,300,13
907,"Nam congue, risus semper porta volutpat, quam pede lobortis ligula, sit amet eleifend pede libero quis orci. Nullam molestie nibh in lectus. Pellentesque at nulla.",2021-02-24 03:22:31,2021-04-10 10:42:12,null,794,48
908,"Nam congue, risus semper porta volutpat, quam pede lobortis ligula, sit amet eleifend pede libero quis orci.",2022-01-10 16:27:26,2021-06-28 11:07:34,null,77,73
909,"Sed sagittis. Nam congue, risus semper porta volutpat, quam pede lobortis ligula, sit amet eleifend pede libero quis orci. Nullam molestie nibh in lectus.",2021-09-11 05:47:27,2021-03-11 11:38:31,null,540,17
910,Pellentesque eget nunc.,2021-11-30 00:44:20,2021-08-12 13:24:55,null,678,62
911,Praesent blandit.,2021-05-21 22:04:18,2021-04-29 08:02:10,9,362,33
912,Fusce consequat. Nulla nisl.,2021-06-10 16:00:11,2021-06-02 22:43:52,9,360,44
913,Nullam varius.,2022-01-14 15:27:59,2021-11-27 18:12:58,9,144,43
914,"Integer pede justo, lacinia eget, tincidunt eget, tempus vel, pede. Morbi porttitor lorem id ligula.",2021-05-03 03:12:00,2021-12-10 09:47:48,9,938,93
915,Suspendisse potenti.,2021-11-22 05:46:49,2021-06-02 19:43:45,9,776,26
916,Suspendisse ornare consequat lectus.,2021-10-30 00:34:28,2021-02-17 13:41:22,9,23,29
917,"Mauris enim leo, rhoncus sed, vestibulum sit amet, cursus id, turpis.",2021-03-22 21:57:18,2021-07-22 09:17:46,9,972,99
918,Aliquam quis turpis eget elit sodales scelerisque. Mauris sit amet eros. Suspendisse accumsan tortor quis turpis.,2022-01-19 13:16:48,2021-10-27 19:27:01,9,535,12
919,Nam dui.,2021-10-03 06:09:46,2021-10-26 04:11:58,9,623,74
920,"Cras in purus eu magna vulputate luctus. Cum sociis natoque penatibus et magnis dis parturient montes, nascetur ridiculus mus.",2021-05-17 12:39:48,2021-02-22 08:54:45,9,921,1
921,Integer non velit.,2021-05-03 15:00:37,2021-08-31 19:39:01,8,225,1
922,In quis justo. Maecenas rhoncus aliquam lacus.,2021-09-28 00:22:29,2021-05-06 13:09:44,8,760,77
923,"Vivamus vestibulum sagittis sapien. Cum sociis natoque penatibus et magnis dis parturient montes, nascetur ridiculus mus.",2021-11-18 21:36:38,2021-05-18 11:04:29,8,298,87
924,"In tempor, turpis nec euismod scelerisque, quam turpis adipiscing lorem, vitae mattis nibh ligula nec sem. Duis aliquam convallis nunc.",2021-08-30 14:20:08,2021-06-22 05:18:17,8,63,61
925,Cras non velit nec nisi vulputate nonummy. Maecenas tincidunt lacus at velit. Vivamus vel nulla eget eros elementum pellentesque.,2021-02-16 05:53:32,2021-08-02 14:58:57,8,342,6
926,Nulla nisl. Nunc nisl.,2021-09-12 09:21:56,2021-03-24 03:53:53,8,318,53
927,"Quisque erat eros, viverra eget, congue eget, semper rutrum, nulla. Nunc purus.",2021-12-22 12:05:16,2021-11-26 23:23:19,8,250,75
928,Nulla nisl.,2021-06-07 02:07:01,2021-04-03 18:01:10,8,68,45
929,In blandit ultrices enim.,2021-02-24 18:57:56,2021-11-26 14:28:41,8,626,70
930,"Quisque porta volutpat erat. Quisque erat eros, viverra eget, congue eget, semper rutrum, nulla.",2021-11-30 05:53:13,2021-10-11 11:59:19,8,857,88
