187,Vestibulum rutrum rutrum neque.,2021-12-14 05:24:49,2021-04-22 16:00:33,187,807,33
188,Maecenas pulvinar lobortis est. Phasellus sit amet erat. Nulla tempus.,2021-02-08 03:52:31,2021-07-12 13:28:43,188,341,31
189,"Vestibulum ante ipsum primis in faucibus orci luctus et ultrices posuere cubilia Curae; Nulla dapibus dolor vel est. Donec odio justo, sollicitudin ut, suscipit a, feugiat et, eros. Vestibulum ac est lacinia nisi venenatis tristique.",2021-12-26 19:04:53,2021-03-11 23:39:57,189,849,67
190,In eleifend quam a odio.,2021-09-26 09:34:39,2021-05-17 15:55:43,190,747,85
191,"Cum sociis natoque penatibus et magnis dis parturient montes, nascetur ridiculus mus. Etiam vel augue.",2021-03-09 04:42:53,2021-12-27 05:59:56,191,362,81
192,Nulla nisl. Nunc nisl.,2021-06-02 09:53:21,2021-12-05 00:07:25,192,321,51
193,Nulla facilisi.,2021-10-07 18:49:44,2021-03-20 22:17:00,193,646,18
194,"Integer aliquet, massa id lobortis convallis, tortor risus dapibus augue, vel accumsan tellus nisi eu orci. Mauris lacinia sapien quis libero. Nullam sit amet turpis elementum ligula vehicula consequat.",2021-09-15 11:26:23,2021-09-04 02:25:16,194,386,13
195,"Praesent blandit. Nam nulla. Integer pede justo, lacinia eget, tincidunt eget, tempus vel, pede.",2021-11-25 21:59:47,2021-08-19 04:43:00,195,900,12
196,"Suspendisse ornare consequat lectus. In est risus, auctor sed, tristique in, tempus sit amet, sem. Fusce consequat.",2021-08-23 06:01:26,2021-06-30 01:02:51,196,744,41
197,"Fusce lacus purus, aliquet at, feugiat non, pretium quis, lectus. Suspendisse potenti. In eleifend quam a odio.",2021-06-06 13:49:42,2021-06-15 08:45:01,197,190,5
198,Vestibulum ante ipsum primis in faucibus orci luctus et ultrices posuere cubilia Curae; Duis faucibus accumsan odio. Curabitur convallis. Duis consequat dui nec nisi volutpat eleifend.,2021-03-16 06:33:00,2021-03-25 16:38:22,198,110,31
199,"Donec odio justo, sollicitudin ut, suscipit a, feugiat et, eros. Vestibulum ac est lacinia nisi venenatis tristique. Fusce congue, diam id ornare imperdiet, sapien urna pretium nisl, ut volutpat sapien arcu sed augue.",2021-06-05 02:39:55,2021-04-29 00:01:51,199,704,7
200,Maecenas ut massa quis augue luctus tincidunt.,2021-12-03 09:35:12,2021-09-05 08:30:10,200,331,83
201,Integer ac leo.,2021-05-04 12:20:25,2021-06-12 14:38:24,201,423,84
202,"Cum sociis natoque penatibus et magnis dis parturient montes, nascetur ridiculus mus.",2021-07-24 01:17:08,2021-09-02 17:17:30,202,231,60
203,Etiam vel augue. Vestibulum rutrum rutrum neque. Aenean auctor gravida sem.,2021-03-31 01:13:19,2021-05-01 14:01:21,203,785,23
204,Integer a nibh. In quis justo.,2021-10-02 02:47:39,2021-03-01 23:17:48,204,162,3
205,Maecenas pulvinar lobortis est.,2021-02-22 19:19:56,2021-03-28 07:12:04,205,649,29
206,"Nunc nisl. Duis bibendum, felis sed interdum venenatis, turpis enim blandit mi, in porttitor pede justo eu massa. Donec dapibus.",2021-09-20 17:53:33,2021-07-01 22:46:15,206,488,12
207,Duis aliquam convallis nunc.,2021-09-12 07:31:27,2021-03-03 02:06:43,207,783,72
208,"Maecenas rhoncus aliquam lacus. Morbi quis tortor id nulla ultrices aliquet. Maecenas leo odio, condimentum id, luctus nec, molestie sed, justo.",2021-12-24 09:18:18,2021-03-28 19:16:36,208,880,72
209,"Nulla ac enim. In tempor, turpis nec euismod scelerisque, quam turpis adipiscing lorem, vitae mattis nibh ligula nec sem. Duis aliquam convallis nunc.",2022-01-10 17:57:00,2021-10-07 13:47:23,209,197,74
210,"Donec odio justo, sollicitudin ut, suscipit a, feugiat et, eros.",2021-02-28 10:16:47,2021-05-16 03:09:22,210,96,45
211,"Curabitur in libero ut massa volutpat convallis. Morbi odio odio, elementum eu, interdum eu, tincidunt in, leo.",2021-12-29 22:05:30,2021-11-10 16:16:24,211,437,11
212,Mauris lacinia sapien quis libero. Nullam sit amet turpis elementum ligula vehicula consequat. Morbi a ipsum.,2021-12-12 06:33:13,2021-11-29 11:06:27,212,270,42
213,"Mauris enim leo, rhoncus sed, vestibulum sit amet, cursus id, turpis. Integer aliquet, massa id lobortis convallis, tortor risus dapibus augue, vel accumsan tellus nisi eu orci. Mauris lacinia sapien quis libero.",2021-06-08 02:47:48,2021-08-17 03:49:25,213,834,60
214,Nunc purus. Phasellus in felis.,2021-05-22 02:49:06,2021-10-08 22:51:07,214,250,99
215,"Lorem ipsum dolor sit amet, consectetuer adipiscing elit.",2021-06-17 14:07:02,2022-01-14 14:59:24,215,564,31
216,"Mauris enim leo, rhoncus sed, vestibulum sit amet, cursus id, turpis. Integer aliquet, massa id lobortis convallis, tortor risus dapibus augue, vel accumsan tellus nisi eu orci.",2021-08-15 14:46:29,2021-04-02 00:41:06,216,77,36
217,"In tempor, turpis nec euismod scelerisque, quam turpis adipiscing lorem, vitae mattis nibh ligula nec sem. Duis aliquam convallis nunc.",2021-02-12 11:12:54,2021-12-07 05:25:55,217,509,58
218,Duis mattis egestas metus.,2021-03-17 22:07:43,2022-01-03 13:33:47,218,142,95
219,Praesent blandit.,2021-08-20 19:11:19,2021-03-23 06:38:18,219,79,49
220,Nunc rhoncus dui vel sem.,2021-05-16 04:35:35,2021-03-10 05:55:42,220,287,15
221,Phasellus sit amet erat. Nulla tempus. Vivamus in felis eu sapien cursus vestibulum.,2022-01-07 05:19:53,2022-01-06 11:00:49,221,658,56
222,"Pellentesque viverra pede ac diam. Cras pellentesque volutpat dui. Maecenas tristique, est et tempus semper, est quam pharetra magna, ac consequat metus sapien ut nunc.",2021-07-05 12:14:30,2021-04-05 22:53:25,222,224,81
223,Mauris sit amet eros. Suspendisse accumsan tortor quis turpis.,2021-08-09 00:32:00,2021-12-17 10:11:38,223,102,37
224,Nulla nisl.,2021-07-21 09:30:45,2022-01-22 14:06:57,224,118,56
225,"Donec vitae nisi. Nam ultrices, libero non mattis pulvinar, nulla pede ullamcorper augue, a suscipit nulla elit ac nulla. Sed vel enim sit amet nunc viverra dapibus.",2021-05-02 10:36:50,2022-01-12 01:34:58,225,808,17
226,Cras non velit nec nisi vulputate nonummy.,2021-12-18 18:15:27,2021-03-02 14:21:45,226,351,56
227,Suspendisse potenti. Cras in purus eu magna vulputate luctus.,2021-10-25 23:15:54,2021-05-22 17:57:16,227,462,3
228,Phasellus in felis. Donec semper sapien a libero. Nam dui.,2021-08-29 05:00:37,2021-04-15 08:21:56,228,777,32
229,Donec quis orci eget orci vehicula condimentum.,2021-08-07 23:01:38,2021-03-10 02:12:42,229,613,28
230,Vivamus in felis eu sapien cursus vestibulum.,2021-05-31 21:11:05,2021-09-15 03:00:37,230,525,20
231,Phasellus in felis.,2021-12-27 07:50:39,2021-06-20 20:26:52,231,182,68
232,"Fusce lacus purus, aliquet at, feugiat non, pretium quis, lectus.",2021-09-25 01:25:24,2021-07-20 04:03:03,232,610,12
233,Vestibulum rutrum rutrum neque. Aenean auctor gravida sem.,2021-02-01 11:23:37,2021-01-29 11:37:06,233,251,100
234,"Curabitur gravida nisi at nibh. In hac habitasse platea dictumst. Aliquam augue quam, sollicitudin vitae, consectetuer eget, rutrum at, lorem.",2021-03-17 06:44:21,2021-12-04 17:04:04,234,932,10
235,Ut tellus.,2021-08-02 14:59:25,2021-09-08 08:15:55,235,799,45
236,Donec semper sapien a libero.,2021-11-02 06:18:47,2021-08-28 22:15:49,236,81,52
237,Ut tellus. Nulla ut erat id mauris vulputate elementum. Nullam varius.,2022-01-13 01:41:41,2021-10-01 17:32:02,237,563,99
238,"Nulla ac enim. In tempor, turpis nec euismod scelerisque, quam turpis adipiscing lorem, vitae mattis nibh ligula nec sem.",2021-12-21 22:50:21,2021-08-27 06:12:46,238,854,43
239,Nulla tellus.,2021-09-26 08:24:01,2021-03-31 08:56:06,239,809,68
240,Donec dapibus.,2021-04-07 21:48:10,2021-05-16 17:28:31,240,700,50
241,Ut tellus.,2021-03-13 05:38:15,2021-02-02 03:52:10,241,344,24
242,Praesent id massa id nisl venenatis lacinia.,2021-09-21 06:33:38,2021-11-09 01:58:56,242,502,12
243,"Integer pede justo, lacinia eget, tincidunt eget, tempus vel, pede. Morbi porttitor lorem id ligula.",2021-02-10 04:21:48,2021-12-07 04:31:18,243,259,58
244,"Praesent lectus. Vestibulum quam sapien, varius ut, blandit non, interdum in, ante. Vestibulum ante ipsum primis in faucibus orci luctus et ultrices posuere cubilia Curae; Duis faucibus accumsan odio.",2021-11-20 04:04:58,2021-04-16 07:58:48,244,767,71
245,Pellentesque eget nunc.,2022-01-13 02:41:41,2021-11-01 13:40:55,245,684,17
246,"Donec ut mauris eget massa tempor convallis. Nulla neque libero, convallis eget, eleifend luctus, ultricies eu, nibh.",2021-03-26 13:31:38,2021-12-03 11:37:09,246,144,36
247,"Phasellus id sapien in sapien iaculis congue. Vivamus metus arcu, adipiscing molestie, hendrerit at, vulputate vitae, nisl.",2021-03-09 19:40:05,2021-09-25 11:25:20,247,51,35
248,"Quisque erat eros, viverra eget, congue eget, semper rutrum, nulla. Nunc purus. Phasellus in felis.",2021-05-22 06:58:58,2021-10-20 01:03:43,248,740,80
249,"Praesent lectus. Vestibulum quam sapien, varius ut, blandit non, interdum in, ante.",2021-03-18 06:47:31,2021-12-04 15:52:37,249,431,78
250,Aenean auctor gravida sem. Praesent id massa id nisl venenatis lacinia. Aenean sit amet justo.,2021-05-19 20:56:04,2021-07-20 01:55:11,250,439,5
251,"Phasellus id sapien in sapien iaculis congue. Vivamus metus arcu, adipiscing molestie, hendrerit at, vulputate vitae, nisl.",2022-01-11 07:26:26,2021-10-21 11:45:45,251,997,77
252,"Integer non velit. Donec diam neque, vestibulum eget, vulputate ut, ultrices vel, augue. Vestibulum ante ipsum primis in faucibus orci luctus et ultrices posuere cubilia Curae; Donec pharetra, magna vestibulum aliquet ultrices, erat tortor sollicitudin mi, sit amet lobortis sapien sapien non mi.",2021-01-26 14:37:20,2021-02-09 08:06:14,252,838,10
253,Praesent id massa id nisl venenatis lacinia. Aenean sit amet justo.,2021-08-10 10:18:45,2021-10-21 04:28:05,253,238,29
254,Morbi porttitor lorem id ligula.,2021-04-14 19:12:50,2021-09-13 22:41:28,254,883,52
255,Donec ut dolor.,2021-08-05 09:31:50,2021-12-07 02:14:13,255,113,2
256,Nulla tellus. In sagittis dui vel nisl.,2021-12-07 14:24:37,2021-04-07 16:43:08,256,623,41
257,"Nunc rhoncus dui vel sem. Sed sagittis. Nam congue, risus semper porta volutpat, quam pede lobortis ligula, sit amet eleifend pede libero quis orci.",2021-02-01 04:20:21,2021-10-21 05:16:21,257,218,5
258,"Nam dui. Proin leo odio, porttitor id, consequat in, consequat ut, nulla.",2021-03-24 01:40:59,2021-05-12 17:49:47,258,684,66
259,"Vestibulum quam sapien, varius ut, blandit non, interdum in, ante.",2021-10-09 00:22:00,2021-10-28 00:33:32,259,162,74
260,"Donec ut dolor. Morbi vel lectus in quam fringilla rhoncus. Mauris enim leo, rhoncus sed, vestibulum sit amet, cursus id, turpis.",2021-03-01 11:19:01,2021-12-13 03:01:09,260,853,22
261,"Lorem ipsum dolor sit amet, consectetuer adipiscing elit.",2022-01-02 04:20:13,2021-08-21 08:26:21,261,214,56
262,"Quisque arcu libero, rutrum ac, lobortis vel, dapibus at, diam.",2021-09-17 05:53:49,2021-09-12 15:34:59,262,452,37
263,Duis at velit eu est congue elementum. In hac habitasse platea dictumst.,2021-08-12 03:07:20,2021-03-23 13:18:43,263,474,40
264,Nunc purus.,2021-10-13 16:39:02,2022-01-17 14:47:44,264,968,75
265,Praesent blandit lacinia erat.,2021-04-16 03:29:58,2022-01-07 07:01:07,265,683,9
266,"Nulla neque libero, convallis eget, eleifend luctus, ultricies eu, nibh. Quisque id justo sit amet sapien dignissim vestibulum. Vestibulum ante ipsum primis in faucibus orci luctus et ultrices posuere cubilia Curae; Nulla dapibus dolor vel est.",2021-08-14 16:06:29,2022-01-09 06:12:50,266,873,67
267,Mauris sit amet eros. Suspendisse accumsan tortor quis turpis. Sed ante.,2021-04-04 20:32:02,2021-03-08 06:34:18,267,444,37
268,Duis bibendum.,2021-02-10 22:04:42,2021-03-11 14:35:06,268,642,65
269,Praesent blandit lacinia erat. Vestibulum sed magna at nunc commodo placerat. Praesent blandit.,2021-12-31 06:17:06,2021-05-05 21:51:11,269,984,69
270,Mauris lacinia sapien quis libero. Nullam sit amet turpis elementum ligula vehicula consequat.,2021-11-15 12:23:12,2021-04-24 02:57:26,270,358,3
271,Suspendisse potenti. In eleifend quam a odio. In hac habitasse platea dictumst.,2021-04-22 09:20:02,2021-03-22 13:17:14,271,248,79
272,Sed ante.,2021-07-29 06:27:59,2021-05-13 06:44:41,272,109,37
273,"Vestibulum ante ipsum primis in faucibus orci luctus et ultrices posuere cubilia Curae; Donec pharetra, magna vestibulum aliquet ultrices, erat tortor sollicitudin mi, sit amet lobortis sapien sapien non mi.",2022-01-09 04:30:14,2021-09-11 08:12:08,273,479,64
274,"Morbi vel lectus in quam fringilla rhoncus. Mauris enim leo, rhoncus sed, vestibulum sit amet, cursus id, turpis.",2021-02-08 02:54:29,2022-01-04 14:23:32,274,49,83
275,"Nam ultrices, libero non mattis pulvinar, nulla pede ullamcorper augue, a suscipit nulla elit ac nulla.",2021-11-15 14:42:47,2021-04-20 07:47:45,275,576,85
276,Vestibulum rutrum rutrum neque. Aenean auctor gravida sem. Praesent id massa id nisl venenatis lacinia.,2021-09-11 11:57:29,2022-01-23 17:48:13,276,525,63
277,Maecenas pulvinar lobortis est.,2022-01-17 13:33:18,2021-06-08 18:54:11,277,38,11
278,"Duis bibendum, felis sed interdum venenatis, turpis enim blandit mi, in porttitor pede justo eu massa. Donec dapibus. Duis at velit eu est congue elementum.",2021-09-17 20:27:21,2021-05-08 23:40:06,278,507,61
279,Proin eu mi.,2022-01-08 23:58:16,2021-12-21 17:56:12,279,393,33
280,Duis consequat dui nec nisi volutpat eleifend. Donec ut dolor.,2021-05-13 06:47:19,2021-11-09 04:41:14,280,283,66
281,Duis mattis egestas metus. Aenean fermentum. Donec ut mauris eget massa tempor convallis.,2021-10-15 21:57:21,2021-02-20 07:25:49,281,872,15
282,Pellentesque viverra pede ac diam. Cras pellentesque volutpat dui.,2021-04-18 03:50:33,2021-07-26 11:58:37,282,535,14
283,Quisque id justo sit amet sapien dignissim vestibulum.,2021-07-07 00:26:34,2021-07-30 05:10:33,283,199,14
284,"Nam ultrices, libero non mattis pulvinar, nulla pede ullamcorper augue, a suscipit nulla elit ac nulla. Sed vel enim sit amet nunc viverra dapibus. Nulla suscipit ligula in lacus.",2021-06-04 02:23:35,2021-12-19 18:02:02,284,806,10
285,Fusce posuere felis sed lacus.,2021-09-22 02:21:20,2021-11-22 07:43:45,285,7,11
286,"Integer pede justo, lacinia eget, tincidunt eget, tempus vel, pede. Morbi porttitor lorem id ligula. Suspendisse ornare consequat lectus.",2021-03-27 04:29:17,2021-06-16 08:23:23,286,220,62
287,Aliquam sit amet diam in magna bibendum imperdiet.,2021-05-18 08:14:12,2021-04-13 01:52:06,287,641,36
288,"Nam nulla. Integer pede justo, lacinia eget, tincidunt eget, tempus vel, pede. Morbi porttitor lorem id ligula.",2021-10-06 14:38:35,2021-02-11 04:48:12,288,744,62
289,Etiam justo. Etiam pretium iaculis justo. In hac habitasse platea dictumst.,2021-12-02 00:58:21,2021-11-11 23:37:52,289,882,54
290,Morbi non quam nec dui luctus rutrum. Nulla tellus.,2021-12-10 16:39:13,2021-12-11 00:38:35,290,552,39
291,Phasellus id sapien in sapien iaculis congue.,2021-11-25 18:37:47,2021-02-21 13:29:43,291,344,92
292,In eleifend quam a odio. In hac habitasse platea dictumst.,2021-10-13 01:29:33,2021-04-25 20:52:50,292,35,60
293,Proin at turpis a pede posuere nonummy. Integer non velit.,2021-11-10 11:03:55,2021-06-11 18:07:04,293,447,73
294,"Vestibulum quam sapien, varius ut, blandit non, interdum in, ante. Vestibulum ante ipsum primis in faucibus orci luctus et ultrices posuere cubilia Curae; Duis faucibus accumsan odio. Curabitur convallis.",2021-10-04 22:13:52,2022-01-07 09:06:43,294,82,39
295,Integer a nibh.,2021-10-18 09:33:54,2021-10-18 07:41:33,295,449,4
296,Vestibulum ante ipsum primis in faucibus orci luctus et ultrices posuere cubilia Curae; Duis faucibus accumsan odio.,2021-05-12 03:37:07,2021-09-23 14:13:28,296,865,91
297,"Aliquam sit amet diam in magna bibendum imperdiet. Nullam orci pede, venenatis non, sodales sed, tincidunt eu, felis.",2021-04-23 02:37:22,2021-08-10 23:18:46,297,876,12
298,Nullam porttitor lacus at turpis. Donec posuere metus vitae ipsum. Aliquam non mauris.,2021-04-03 23:52:10,2021-04-10 21:15:52,298,787,78
299,Morbi porttitor lorem id ligula.,2021-03-05 18:46:17,2021-03-21 03:03:57,299,823,92
300,"Morbi odio odio, elementum eu, interdum eu, tincidunt in, leo. Maecenas pulvinar lobortis est. Phasellus sit amet erat.",2021-12-11 01:30:24,2021-07-08 15:51:37,300,480,36
301,"Nam nulla. Integer pede justo, lacinia eget, tincidunt eget, tempus vel, pede. Morbi porttitor lorem id ligula.",2021-06-28 05:36:22,2021-03-18 11:54:00,301,463,82
302,Donec quis orci eget orci vehicula condimentum.,2021-05-28 19:44:20,2021-03-22 20:34:43,302,55,63
303,"In hac habitasse platea dictumst. Aliquam augue quam, sollicitudin vitae, consectetuer eget, rutrum at, lorem.",2021-03-25 10:53:21,2021-04-28 23:19:06,303,670,42
304,Integer ac leo. Pellentesque ultrices mattis odio.,2021-07-18 22:45:52,2021-10-17 12:46:53,304,846,12
305,Fusce consequat. Nulla nisl.,2021-09-23 02:21:31,2021-08-15 05:02:06,305,519,26
306,Praesent blandit.,2021-03-30 20:08:31,2021-03-08 17:20:32,306,148,30
307,"Sed sagittis. Nam congue, risus semper porta volutpat, quam pede lobortis ligula, sit amet eleifend pede libero quis orci.",2021-10-10 21:09:17,2021-10-07 20:21:05,307,804,51
308,Quisque id justo sit amet sapien dignissim vestibulum.,2021-11-15 10:31:49,2021-10-28 14:10:10,308,684,3
309,"Vestibulum ante ipsum primis in faucibus orci luctus et ultrices posuere cubilia Curae; Donec pharetra, magna vestibulum aliquet ultrices, erat tortor sollicitudin mi, sit amet lobortis sapien sapien non mi.",2021-02-27 12:59:32,2021-05-13 11:37:38,309,625,50
310,Mauris sit amet eros. Suspendisse accumsan tortor quis turpis.,2021-03-09 16:52:55,2021-07-29 01:22:58,310,374,56
311,"Suspendisse ornare consequat lectus. In est risus, auctor sed, tristique in, tempus sit amet, sem. Fusce consequat.",2021-11-13 01:31:08,2021-05-07 10:09:08,311,681,33
312,"Donec ut dolor. Morbi vel lectus in quam fringilla rhoncus. Mauris enim leo, rhoncus sed, vestibulum sit amet, cursus id, turpis.",2021-07-17 07:52:20,2021-12-08 06:22:35,312,305,24
313,Proin interdum mauris non ligula pellentesque ultrices. Phasellus id sapien in sapien iaculis congue.,2021-06-03 06:36:57,2021-10-11 03:00:37,313,721,27
314,Praesent lectus.,2021-04-25 21:51:33,2022-01-20 02:05:56,314,288,74
315,Sed accumsan felis. Ut at dolor quis odio consequat varius.,2021-10-11 00:02:44,2021-03-23 19:20:45,315,520,75
316,Donec dapibus. Duis at velit eu est congue elementum.,2021-07-19 01:54:54,2021-12-15 17:17:39,316,730,6
317,Morbi non lectus.,2021-09-19 06:59:27,2021-12-21 11:38:47,317,346,83
318,Nam nulla.,2021-04-26 21:43:40,2021-08-24 12:58:33,318,693,51
319,"Nulla neque libero, convallis eget, eleifend luctus, ultricies eu, nibh.",2021-08-30 01:16:57,2021-11-08 00:31:55,319,916,80
320,"Mauris enim leo, rhoncus sed, vestibulum sit amet, cursus id, turpis. Integer aliquet, massa id lobortis convallis, tortor risus dapibus augue, vel accumsan tellus nisi eu orci. Mauris lacinia sapien quis libero.",2021-04-26 21:28:07,2021-04-04 08:13:26,320,606,27
321,Sed vel enim sit amet nunc viverra dapibus. Nulla suscipit ligula in lacus.,2021-03-08 03:57:50,2021-09-01 22:42:40,321,502,9
322,Mauris ullamcorper purus sit amet nulla.,2021-12-23 14:43:00,2021-07-09 16:17:59,322,746,44
323,Aenean sit amet justo. Morbi ut odio.,2021-02-26 07:25:41,2021-10-09 18:37:45,323,371,1
324,Donec dapibus.,2021-09-14 07:33:13,2021-05-18 00:04:02,324,77,95
325,Nullam sit amet turpis elementum ligula vehicula consequat. Morbi a ipsum. Integer a nibh.,2022-01-07 13:21:41,2021-05-20 15:21:11,325,474,95
326,"In est risus, auctor sed, tristique in, tempus sit amet, sem. Fusce consequat. Nulla nisl.",2021-09-29 03:06:29,2021-01-31 04:04:33,326,921,65
327,Aenean sit amet justo. Morbi ut odio.,2021-12-11 02:05:49,2021-07-31 14:45:56,327,962,7
328,Proin eu mi. Nulla ac enim.,2021-04-11 17:10:42,2021-10-27 16:34:16,328,207,28
329,"Cras mi pede, malesuada in, imperdiet et, commodo vulputate, justo.",2021-02-22 17:09:32,2021-03-01 20:46:21,329,595,96
330,"Nulla neque libero, convallis eget, eleifend luctus, ultricies eu, nibh. Quisque id justo sit amet sapien dignissim vestibulum. Vestibulum ante ipsum primis in faucibus orci luctus et ultrices posuere cubilia Curae; Nulla dapibus dolor vel est.",2021-01-29 04:10:38,2021-04-21 19:36:53,330,963,98
331,Duis mattis egestas metus. Aenean fermentum.,2021-06-28 07:08:39,2021-05-08 18:46:34,331,435,71
332,Morbi porttitor lorem id ligula. Suspendisse ornare consequat lectus.,2021-02-05 00:26:45,2021-02-22 21:16:31,332,549,70
333,"Vivamus vel nulla eget eros elementum pellentesque. Quisque porta volutpat erat. Quisque erat eros, viverra eget, congue eget, semper rutrum, nulla.",2021-09-17 08:59:13,2021-03-07 05:34:29,333,211,21
334,Nulla nisl. Nunc nisl.,2021-04-27 08:11:00,2021-07-30 00:08:51,334,702,71
335,Duis mattis egestas metus.,2021-04-01 10:36:14,2021-10-13 15:09:52,335,341,28
336,"Aenean sit amet justo. Morbi ut odio. Cras mi pede, malesuada in, imperdiet et, commodo vulputate, justo.",2021-12-25 11:36:21,2021-05-25 22:30:45,336,268,9
337,Suspendisse accumsan tortor quis turpis. Sed ante.,2022-01-25 02:45:36,2021-06-02 21:02:37,337,629,34
338,Nullam molestie nibh in lectus.,2021-12-11 06:42:39,2021-12-25 21:58:29,338,256,94
339,Suspendisse accumsan tortor quis turpis. Sed ante. Vivamus tortor.,2021-07-16 06:50:42,2021-05-16 17:57:23,339,513,80
340,"Mauris enim leo, rhoncus sed, vestibulum sit amet, cursus id, turpis.",2021-06-27 12:04:32,2021-07-18 09:50:10,340,487,65
341,Suspendisse potenti. Nullam porttitor lacus at turpis.,2021-04-28 06:45:53,2021-08-05 18:08:33,341,658,90
342,In eleifend quam a odio. In hac habitasse platea dictumst.,2021-12-09 04:43:36,2021-06-04 21:31:32,342,309,65
343,Proin risus. Praesent lectus.,2022-01-16 19:28:22,2021-09-03 22:40:10,343,272,80
344,Sed accumsan felis. Ut at dolor quis odio consequat varius.,2021-06-20 14:38:18,2021-11-03 13:43:17,344,138,88
345,Nulla ut erat id mauris vulputate elementum. Nullam varius. Nulla facilisi.,2021-02-08 12:39:12,2021-05-27 09:41:22,345,801,18
346,Praesent blandit lacinia erat.,2021-07-05 20:30:06,2021-09-01 12:47:28,346,467,30
347,Nulla tempus. Vivamus in felis eu sapien cursus vestibulum. Proin eu mi.,2021-04-01 20:53:34,2021-03-17 23:25:58,347,133,94
348,"Fusce congue, diam id ornare imperdiet, sapien urna pretium nisl, ut volutpat sapien arcu sed augue.",2021-08-23 01:35:00,2021-02-08 11:27:07,348,660,75
349,Proin eu mi.,2021-03-02 10:52:28,2021-05-11 23:34:00,349,347,46
350,Maecenas pulvinar lobortis est. Phasellus sit amet erat.,2021-03-15 23:32:55,2021-05-27 15:20:24,350,945,72
351,Nulla tellus. In sagittis dui vel nisl.,2021-04-10 10:21:22,2021-02-06 23:29:30,351,164,24
352,Aenean sit amet justo. Morbi ut odio.,2021-07-19 14:44:47,2021-06-13 20:02:40,352,652,14
353,Nunc rhoncus dui vel sem. Sed sagittis.,2021-08-31 00:30:32,2022-01-01 00:50:39,353,99,14
354,Nulla suscipit ligula in lacus.,2021-12-20 05:12:53,2021-10-09 14:25:31,354,152,92
355,Duis aliquam convallis nunc. Proin at turpis a pede posuere nonummy.,2021-04-18 17:49:52,2021-06-08 00:50:21,355,466,84
356,Vestibulum sed magna at nunc commodo placerat. Praesent blandit.,2021-12-02 00:25:52,2021-11-16 12:15:36,356,783,91
357,"Proin at turpis a pede posuere nonummy. Integer non velit. Donec diam neque, vestibulum eget, vulputate ut, ultrices vel, augue.",2021-10-16 11:10:12,2022-01-22 11:31:12,357,882,33
358,"Praesent blandit. Nam nulla. Integer pede justo, lacinia eget, tincidunt eget, tempus vel, pede.",2021-04-03 13:08:47,2022-01-10 06:51:29,358,413,88
359,Donec ut dolor. Morbi vel lectus in quam fringilla rhoncus.,2021-12-28 10:13:06,2021-02-20 02:46:45,359,376,86
360,"Duis ac nibh. Fusce lacus purus, aliquet at, feugiat non, pretium quis, lectus. Suspendisse potenti.",2022-01-06 04:35:06,2021-09-13 16:19:30,360,498,97
361,"Maecenas rhoncus aliquam lacus. Morbi quis tortor id nulla ultrices aliquet. Maecenas leo odio, condimentum id, luctus nec, molestie sed, justo.",2021-02-05 02:08:48,2021-03-17 21:32:24,361,327,30
362,"Lorem ipsum dolor sit amet, consectetuer adipiscing elit. Proin risus.",2021-07-14 15:42:34,2021-07-04 19:53:39,362,140,58
363,Proin interdum mauris non ligula pellentesque ultrices. Phasellus id sapien in sapien iaculis congue.,2022-01-04 13:06:53,2021-11-06 00:15:59,363,944,65
364,Vestibulum rutrum rutrum neque. Aenean auctor gravida sem. Praesent id massa id nisl venenatis lacinia.,2021-04-28 23:14:47,2021-12-08 07:01:48,364,454,76
365,"Nam dui. Proin leo odio, porttitor id, consequat in, consequat ut, nulla.",2022-01-23 00:01:24,2021-05-18 18:01:09,365,474,52
366,"Morbi vestibulum, velit id pretium iaculis, diam erat fermentum justo, nec condimentum neque sapien placerat ante.",2021-05-12 23:02:13,2021-12-14 21:53:00,366,425,58
367,"Duis ac nibh. Fusce lacus purus, aliquet at, feugiat non, pretium quis, lectus.",2021-02-24 02:58:43,2021-07-27 10:25:43,367,959,16
368,Praesent blandit lacinia erat. Vestibulum sed magna at nunc commodo placerat. Praesent blandit.,2021-06-21 08:37:57,2021-12-27 03:58:24,368,880,47
369,"Cum sociis natoque penatibus et magnis dis parturient montes, nascetur ridiculus mus.",2021-05-24 15:20:29,2022-01-04 04:42:30,369,570,64
370,Morbi non quam nec dui luctus rutrum.,2021-06-09 21:43:15,2021-05-06 14:43:05,370,968,31
371,In congue.,2021-09-25 18:19:24,2021-06-01 06:38:34,371,967,56
372,"Cras in purus eu magna vulputate luctus. Cum sociis natoque penatibus et magnis dis parturient montes, nascetur ridiculus mus. Vivamus vestibulum sagittis sapien.",2021-06-07 22:02:39,2021-10-27 03:40:37,372,357,88
373,Nullam porttitor lacus at turpis.,2022-01-13 20:54:31,2021-09-24 05:41:37,373,569,88
374,Maecenas tincidunt lacus at velit. Vivamus vel nulla eget eros elementum pellentesque. Quisque porta volutpat erat.,2021-08-09 01:34:25,2021-02-21 18:37:54,374,964,90
375,Praesent id massa id nisl venenatis lacinia.,2021-08-30 02:39:03,2021-02-24 15:34:06,375,212,14
376,"Mauris ullamcorper purus sit amet nulla. Quisque arcu libero, rutrum ac, lobortis vel, dapibus at, diam. Nam tristique tortor eu pede.",2021-09-07 00:15:30,2021-06-09 05:27:15,376,414,27
377,Nullam varius. Nulla facilisi.,2021-02-13 05:44:47,2021-08-25 06:27:18,377,910,59
